videoId,title,channelId,channelTitle,uploaded
4lVKEEysAr0,10 More Funny Questions to ask Alexa and Google Home | Hindi,UCL5et1s49vM1uia_iEKbfwQ,TQnet,2020-06-14T14:34:12Z
3_uzhxx-xns,How to setup the Google Home Mini,UC60o55QG_Yabb1nelfSGO0w,Phandroid,2017-10-07T16:01:01Z
YVbMciuhA8E,&quot;Goo-Goo&quot; Grandma Goes Viral After Trying To Use Her Google Home For The First Time,UCEs-zSwH2NYGskxF-ptoT1w,Steve TV Show,2018-02-26T23:08:24Z
_k5qVtXF9jU,"Google Home Mini, ¿para qué sirve? ¿vale la pena?",UCkdFXlSdL1cmYbpbry2wsdA,Alejandro Pérez,2018-10-21T16:44:10Z
mDHIbV0GJSo,"Google Home Mini Review (in Hindi) - Smart Speaker for Rs. 4,999 (+Surprise)",UCix7HIJ74fUDlHDkAAcyRPA,Gogi Tech,2018-04-13T07:08:28Z
QG6GCyWBOSM,SFIDA ALEXA vs. GOOGLE HOME | Chi è il più intelligente?,UCWvaO5qbph2r5yob1ZGLgfQ,Ferry,2018-12-14T13:00:04Z
uDI6kGfV-6Q,Smart Home Setups - Google Home + Philips Hue!,UCDlQwv99CovKafGvxyaiNDA,Jonathan Morrison,2016-12-31T21:17:56Z
tftBy4JOLfU,Amazon Echo vs Google Home | ¿Cuál es mejor?,UCXIEHct5_YWZhddzOLCDYhg,El Androide Libre,2019-01-22T17:00:06Z
_HPqvk1i4SU,RASAKAN SENSASI DI MASA DEPAN DENGAN ALAT INI! | Review + Unboxing Google Home,UCHeJ66MuA0JFQKnm_Yxpb0g,Kevin Hendrawan,2017-07-12T11:00:04Z
3kakhXL4avk,12 Cosas INCREÍBLES que puedes hacer con GOOGLE HOME,UCoTyVfIkM-hjz4JauDoVvog,ExpCaseros,2018-12-17T20:13:13Z
56miYa3-7gY,Google Home - Désormais Disponible - Google France,UC6KUvtitNkyAZdJpR03DAHg,Google France,2017-08-03T08:16:47Z
svg9E-19F4M,Il Miglior Assistente Vocale?? GOOGLE Contro AMAZON,UCxO46fGxONZ6CbRs58MtNSg,BasemenTech,2018-11-20T20:50:04Z
1Bf2tR7C1AY,How to control your TV with Google Home,UCOmcA3f_RrH6b9NmcNa4tdg,CNET,2016-11-14T19:13:59Z
XTaEGavsa24,Cómo empezar tu Smart Home,UCEgF6KhiOxSe-oRDUJba3Kg,Victor Abarca,2019-01-09T02:01:00Z
dvt_TnRrtbg,What the Google Home Mini can do in your Smart Home,UC05l2uRKGCpZU2sM8A1AMqg,Brian Alex,2017-10-30T20:00:01Z
LxuHbgz1UtI,Meet Nest Hub,UCWmlRLAOpx9f1t_cVkBx8-g,Google Nest,2018-10-09T15:36:07Z
Zqd98YwWqMs,"Google Home Mini en español, ¿es útil?",UCEgF6KhiOxSe-oRDUJba3Kg,Victor Abarca,2018-07-21T17:15:03Z
4xWkqGZeWIc,Trên tay CƠN SỐT LOA GOOGLE HOME nói tiếng Việt ? Đáng mua VKL,UCSeca92q0ZaRIcLOcsNsQyg,BanLinhKien.Vn,2019-06-23T00:57:43Z
vZGbKPHOjAM,【人工知能】話題の「しゃべるスピーカー」と会話した結果…ブチギレ寸前【Google Home Mini】,UC9WJo5ZJVXMZiA5XV2jLx5Q,吉田製作所,2019-08-10T23:58:14Z
VFKWyMSwoCs,How to Setup Google Home for Beginners,UChY9Cgv-iyPDvf1Bkyx20OQ,My Mate VINCE,2017-09-16T11:45:15Z
_KG7xdiK-IM,Alexa | Google Home | Tell Each Other Jokes,UCBmEfOPthLJb5lTYZzxtFmg,Cheil UK,2018-04-13T12:18:45Z
zq-eSYTGbAY,FINALMENTE L&#39;HO COMPRATO! - Google Home,UCDz3CjAc51W-YtsxYtSPZXg,GiampyTek,2018-04-05T13:03:01Z
nEInzisK78c,Sjov med Google Home #2,UCVNSyYuNQUwJiD0TVst9Szg,Niki Topgaard,2019-05-05T08:00:07Z
pM7qhOtZ8_c,便利すぎ！車内でGoogle Home使ってみた！,UCVPz_nauEJpqPxxvYiOpCHQ,カズチャンネル/Kazu Channel,2017-12-16T10:00:09Z
3BJVTypIMI4,Philips Hue Smart Lights Setup (with Alexa &amp; Google Home!) | The Tech Chap,UCzlXf-yUIaOpOjEjPrOO9TA,The Tech Chap,2017-12-05T18:05:25Z
_GdvyWH5q2U,Google Assistant - What can it do in 2020?,UCJOl2JvledP26K2OQ_HLgnQ,6 Months Later Reviews,2020-01-04T04:15:00Z
6G1mx8vc8Vg,Google Home Mini and Max first look,UCddiUEpeqJcYeBxX1IVBKvQ,The Verge,2017-10-04T20:00:00Z
p5ZeYN-_V0o,Sjov med Google Home #3,UCVNSyYuNQUwJiD0TVst9Szg,Niki Topgaard,2019-09-14T11:48:31Z
y-uC-orQRlg,Nonna italiana sfida la tecnologia di Google Home. Il video è a dir poco esilarante,UCWJhBqnyVdHAuxexgjghNFw,Fanpage.it,2018-01-22T12:06:36Z
Bfxo3DBo7p4,10 TRUCOS y COMANDOS para tu Google Home,UCXIEHct5_YWZhddzOLCDYhg,El Androide Libre,2018-12-28T17:45:00Z
LZzOeVFj1m8,Tech Tips: How to set up a Google Home routine.,UC5pK3w6QEq1bUMmU2Hs43Pw,Best Buy,2019-12-18T21:20:42Z
hdwTCf0l0KI,Top 10 Google Home Fails( Google Home Mini Fails),UCtCqDvKJgx0PsRV_P7qlh-Q,Listed,2017-12-29T21:30:00Z
JONGt32mfRY,Home Alone Commercial - Google - Macaulay Culkin,UCdj1E1s9o3iXR_jVjOpYVJg,Adrienne Grayce,2018-12-20T04:04:21Z
EZ5fi43XxmA,Russian Google Home,UCS18HVYROSI9ovau2oZf5Kw,Bald Pokémon,2017-11-10T16:30:00Z
vxIKbOqUR3E,How To Setup Your Music Services To Google Home Devices,UCmHO0Rw7nBFK2233om_vyWA,Tech Steve,2018-01-05T04:40:06Z
1KVNK-T1jdI,Trucos AVANZADOS para tu GOOGLE HOME (Parte 1) | Sácale MÁS provecho + Review Google Nest Home Mini,UCbotAzxzA5Y8WcjNh5K9ZkQ,Tecnoanalisis en Español,2019-01-27T23:00:02Z
nVL_zjP-1i0,"Un mese con GOOGLE HOME Recensione TicHome, Home e Mini",UC5yXB_ThsufRJYMRlzIGoeQ,andreagaleazzi.com,2018-05-06T09:00:09Z
NIeGL1k50CE,Introducing Technoblade Home,UCryKACitFpPVPiqvYH6pQBQ,OmicronGaming,2019-07-20T16:30:00Z
dvL9CdNNfbY,"Claro que Funciona, Controlo toda mi casa con Google Home Mini Review -  México◀︎Denek32",UCFkRM-EP0VNqkuFrkHSkGFg,Denek32,2018-11-03T16:00:06Z
Ikouo8N1hA0,Quickly Add a New Smart Light to Your Google Home,UCjMVmz06abZGVdWjd1mAMnQ,Tech With Brett,2018-05-25T13:00:03Z
9WqGvjMzEBI,"GOOGLE HOME ya en ESPAÑA, lo probamos: Qué puedes y qué no puedes hacer con él",UCUrYBZGlEOSD1_ds_HcNd6A,Xataka TV,2018-06-19T17:35:40Z
Z-_YSEi_nbQ,Literally Just 15 Minutes of Google Home Telling Jokes,UCBpH9uGYnjck8xHuD3xH1qQ,David Chen,2016-11-07T17:10:30Z
2_pE3f4lJio,Meet Google Home Max,UCWmlRLAOpx9f1t_cVkBx8-g,Google Nest,2017-10-04T16:59:50Z
aac-3QLNXOk,SHOWDOWN: Google Home Hub VS New Amazon Echo Show!,UC9fSZHEh6XsRpX-xJc6lT3A,UrAvgConsumer,2018-11-20T20:06:33Z
HrHe3Eop8uk,HABLANDO CON GOOGLE HOME,UCau9ZBF9vN8sNSc9fkbH3xg,soyrafaAnimacion,2020-03-28T19:00:04Z
OlVG3QjsQOo,ULTIEME TEST: BLIJVEN ZE VAN HET SNOEP AF? @GOOGLE HOME HUIS | VLOG #193,UCnBr_yJS0OTvMVu7jeqaPwA,FAMILIE LAKAP,2018-11-20T06:00:00Z
0Mls_BDLzGQ,Pair Your Google Home Mini to a Bluetooth Speaker,UCjMVmz06abZGVdWjd1mAMnQ,Tech With Brett,2018-08-17T13:00:00Z
ICOmPm5xtzk,Full Tour of the NEW Google Home App,UCjMVmz06abZGVdWjd1mAMnQ,Tech With Brett,2018-10-15T15:35:53Z
bfCSPDFj3cE,Provo Google Home e finisce MALISSIMO,UCHA-Jrd72-L3plh59UAhE7g,Otto Climan,2018-03-28T18:54:21Z
naaX0DIhnag,Wake Up to Music With Your Google Home,UCjMVmz06abZGVdWjd1mAMnQ,Tech With Brett,2018-02-02T16:30:58Z
3butTaW67dw,Google Home en México y así lo probamos,UCL77wBJaCEeEe2gdcEqY6nQ,Unocero,2018-06-26T14:01:13Z
E51X050XtU4,How to Connect &amp; Setup Google Home &amp; Home Mini in Phone,UCzvmBKjsw19OY5RBauMtVpA,MJ Tube,2018-11-07T13:50:11Z
KVh6-TMELwA,10 Funny Questions to Ask Alexa and Google Home in Hindi,UCL5et1s49vM1uia_iEKbfwQ,TQnet,2019-11-23T06:45:09Z
sXmOH_El3qo,How to Setup The Google Home Mini,UCtRSKEipM17PF7n0mi66btQ,Automate Your Life,2018-10-09T19:00:10Z
FM1aQJdlbSQ,5  Things Google Home Can Do,UCzeuQOo2f0nw17Hq-CRNoug,Mitesh Shah,2018-02-18T14:00:01Z
LtJ8MNJDbXQ,How To Factory Reset Google Home Mini.,UCvSXieHSXQY4YvkQAbYYOXQ,CV Tech,2017-12-21T23:35:02Z
7b3pN7GVk8s,Google Home: 15 lustige Sprachbefehle und Easter Eggs – TURN ON Spezial,UCip1RVSGWtkukxd0Am1NiRQ,TURN ON,2017-08-23T12:00:01Z
_HeDEsw_VyI,Google Home Hub Setup &amp; Home View Walkthrough,UCjMVmz06abZGVdWjd1mAMnQ,Tech With Brett,2018-10-26T13:05:46Z
lYxN5H8fY1g,Tout ce que l&#39;on peut faire avec Google Home !,UCUaHJ0fTA-1theR8A8Polmw,01TV,2017-05-24T16:00:26Z
pkKhQrdW3LE,GOOGLE HOME | Qué es y cómo sacarle partido | ChicaGeek,UCGdlvijxkue8x5AyBrBUljQ,ChicaGeek,2018-12-10T16:10:06Z
Mb4tN-L6hc4,Google Home : le test complet avec des démos en français,UCgoxc-VKU0cw9BcM9z_qokg,Frandroid,2017-08-12T10:03:10Z
c4c_-3Njss0,Make Phone Calls From Google Home Devices,UCmHO0Rw7nBFK2233om_vyWA,Tech Steve,2017-12-29T17:52:19Z
duIfmYaA1Sk,Don&#39;t Buy Smart Speaker 😡 | Google Home | Amazon Alexa Etc.,UC1D1vdq169T7w5iJ45zZL5Q,Technical Dost,2019-12-17T16:22:20Z
fVn9gbAfzC0,"Google Home Mini Unboxing ,Setup &amp; Review ll in telugu ll",UCb-xXZ7ltTvrh9C6DgB9H-Q,Prasadtechintelugu,2018-05-04T11:11:04Z
TvhIMmW4TYQ,5 Google Home/Google Assistant Commands &amp; Tricks that you will ACTUALLY USE!,UCa5-N7CN3bwuGT6vl2RmdQg,NextTimeTech,2018-10-17T00:43:25Z
8FW4NSwtzow,Go On An Adventure With Mickey Mouse &amp; Google Home,UC_5niPa-d35gg88HaS7RrIw,Disney,2017-11-28T18:51:56Z
6numfb3G3XQ,Así funciona Google Assistant con un Home Mini en español de México,UCSY4ttNkZ_GncKtQTNSr2rw,Xataka México,2018-06-18T20:45:00Z
Jr0i1UHK0NA,Broadlink Mini 3 TV Remote Setup for Alexa &amp; Google Home,UCjMVmz06abZGVdWjd1mAMnQ,Tech With Brett,2018-08-11T13:00:04Z
JpP7pvo6Z6g,Het slimste huis van Nederland met Google Home en Z-Wave,UCqsNfEAZ2UiubN60BSO3uIg,Tweakers Tech Hub,2019-05-27T21:03:52Z
dBo0xErdjcw,Google Home Hub review: Small smart display with big smart home powers,UCOmcA3f_RrH6b9NmcNa4tdg,CNET,2018-10-22T11:00:09Z
EIhq2Cbug2c,Trải nghiệm cơn sốt GOOGLE HOME Mini nói tiếng Việt với iPhone,UCsFilrMH2u0mjbu0Cw2HTkQ,Mobile City,2019-07-07T04:30:02Z
ZfPB-pf5x80,25 Fonctions de Google Home en Français !,UCHGvOgxAA_MFOH1yyhjcR-Q,ArtBen,2017-09-21T17:26:32Z
6dH9RaUJfLI,Tuto Android ChromeCast Google Home Connectez Votre Smartphone Sur Votre Télé  TV Box Portable !,UCVHeb0aSwL7p_Njrx10z0yQ,Vision High-Tech,2018-02-18T18:11:46Z
HDUl-TpObVc,Google Home Devices: Top 6 Features,UCJOl2JvledP26K2OQ_HLgnQ,6 Months Later Reviews,2017-12-24T18:20:03Z
fDh5YerTCtA,GOOGLE HOME MINI : INDISPENSABLE ?,UCrs2S-Ilj6R6qhhXCiV5hsQ,Tech Live,2018-01-06T09:30:00Z
RZNqSy-zFXo,Carpool | Google Home now supports multiple users,UCIG1k8umaCIIrujZPzZPIMA,Made by Google,2017-04-20T16:11:54Z
UhnZ-c_Y_2Q,GOOGLE HOME e MINI Unboxing e prima configurazione,UC5yXB_ThsufRJYMRlzIGoeQ,andreagaleazzi.com,2018-03-26T14:38:07Z
biFiEO2JZAw,"Google Home, o Android na sua casa [Análise / Review]",UC_bXJnsgwOqEPA_-6N6faKw,Canaltech,2017-04-03T15:41:51Z
5qL_QfYdc48,Google Home Hub hands-on,UCddiUEpeqJcYeBxX1IVBKvQ,The Verge,2018-10-09T18:22:42Z
px4581j90so,Google Home Mini Español: TODO LO QUE HACE,UCyaz3hmZll7xD-2YTXOqjHA,Mundo Altavoces,2018-07-10T22:20:16Z
pd1I025g75Q,Get to know Google Home Hub,UCK8sQmJBp8GCxrOtXWBpyEA,Google,2018-10-10T13:50:30Z
A2MvUieJhCI,Combine Smart Life Products Into One App &amp; Link to Google Home,UCjMVmz06abZGVdWjd1mAMnQ,Tech With Brett,2018-01-04T15:30:30Z
KgxGnZH94mA,Полный обзор Google Home,UCDF_NIAEkcAUvzxe1DUzaQA,Rozetked,2017-01-12T17:02:19Z
AnbW-JXdqg8,How to Setup Your Google Home with LG 4K Ultra HD Smart LED ThinQ TV,UClv1BqvwFQRBClGwvaFcKLQ,Caroline Dunn,2018-12-20T17:00:00Z
K5Tv5slwK74,Configurer Google Home pour la première fois,UCwc8ELDUDl6I8S_-L0RroxA,Formation informatique avec Cedric,2018-08-24T16:00:03Z
XLzKS7EkjQM,Google Home Mini Smart Speaker - REVIEW,UCcGYJndqreqXMUZoOhn3E7A,JimsReviewRoom,2017-11-14T13:00:02Z
-D2iv5GszD4,"Controlando el aire acondicionado, la tele y mucho más con Google Home",UCe1FDuO_eqI4M9U9UyLBOhA,Just Unboxing,2019-01-08T17:00:00Z
JSLvEYFWsJs,Google Home Challenge,UCQ3FRaHOIwXLOQNeUwVpBUA,8 Passengers,2020-04-07T12:00:08Z
28aUnKSJ_P8,"How Google Home Works? First Impression, Demo &amp; Setup | Digit.in",UCXpIVRiyfsMB2aXXn2yq6LA,Digit,2016-10-06T05:15:33Z
Vd1fLZUaMLg,Déballage Astuce Et Configuration Du [Google Home Mini] Vaut-il Vraiment Un Google Home Classique ?,UCVHeb0aSwL7p_Njrx10z0yQ,Vision High-Tech,2018-02-28T17:56:34Z
HK17k65CAno,Angry Alexa VS Google Home,UCDhIFJjqfbHEo4LKmVF_69Q,GabbyKatz World,2017-03-31T16:45:55Z
aGdhSlJuCrE,"Cuma Dengan 679RIBU, Rumah Udah Jadi Smarthome &amp; Makin Nyaman | Google Nest Mini 2 Review",UCN4NEg52XVGn_itFQqlESFA,DK ID,2020-03-22T14:41:33Z
EpI68Nc2EGo,I&#39;m in Love with Google Home Mini - My New Personal Assistant,UCpgnh4y4rPc9jc_xpKBDm6Q,Sohag360,2018-04-11T16:51:19Z
1jyFrQTVCk4,Como Cambiar la conexion Wifi en el Google Home,UC1YUGcTACc_H6ws-G2pPkvg,SOLO SMARTECH,2018-10-05T14:00:01Z
Gfc9UphfNxk,"Google Home unboxing, configuración y primer contacto - el altavoz INTELIGENTE en español-",UCYkoAtIMi6oFG_8SO5YrauQ,clipset,2018-06-19T16:10:05Z
IZSUMfjVEbQ,The Google Home Mini Full Setup Video,UCtRSKEipM17PF7n0mi66btQ,Automate Your Life,2018-12-21T18:00:04Z
-HCaHT5qcE4,Cooking | Google Home now provides step-by-step recipe instructions,UCIG1k8umaCIIrujZPzZPIMA,Made by Google,2017-05-16T18:53:35Z
79HSsf46OGU,How to connect mobile phone to TV with Google home app screen mirroring,UC2hq-jI0YQJEYvGvBQS4yFg,Knowledge 247,2020-02-19T15:35:30Z
BQOAbRUeFRo,Google Home Multiple Users Setup,UCjMVmz06abZGVdWjd1mAMnQ,Tech With Brett,2017-06-29T12:30:00Z
IOy2GG1wRgE,Google Home MINI : JARVIS IRON MAN HARGA ANAK KOS!,UCHeJ66MuA0JFQKnm_Yxpb0g,Kevin Hendrawan,2017-12-12T11:00:02Z
3bjOYo-kgIY,UNBOXING &amp; REVIEW - Google Home - Boxa cu inteligență artificială!,UCNz5n8PoSGYSwkOH_SMnl2A,George Buhnici,2017-02-18T07:42:08Z
tdY3Q0xqBvI,2019 Google Home App Update &amp; New Features,UCjMVmz06abZGVdWjd1mAMnQ,Tech With Brett,2019-11-11T17:31:34Z
K9RrQ341qyE,Amazon Echo vs. Google Home first impressions,UCJOl2JvledP26K2OQ_HLgnQ,6 Months Later Reviews,2018-08-26T23:31:43Z
vi5fvMZu0Ko,GOOGLE ASYSTENT OFICJALNIE W POLSCE. Tak steruje moim domem,UC-867iftJqBGr0mQ83xqyKw,Spider's Web TV,2019-01-16T05:03:21Z
GXU_LP6WDB8,Google Home Mini [Análise / Review],UC_bXJnsgwOqEPA_-6N6faKw,Canaltech,2017-12-28T12:00:02Z
bhh0aRUxV_w,الذكاء الاصطناعي في قلب بيتك | مراجعة Google Home Mini,UCuTqC4B8AhV5z_YrGlZeZ3g,Lawendy Tech لاوندي تك,2018-01-18T17:20:24Z
B5ab2u3D3I4,Google Home：使い方 調べもの 篇,UCTnRxVUPssiL7H29ON07t_Q,Google Japan,2017-10-05T03:04:31Z
wVBYZv_MOKk,At home with Google Home in Singapore,UC83jt4dlz1Gjl58fzQrrKZg,CNA,2018-04-18T10:35:58Z
_4xkuDq9Vzg,Google Home Mini &amp; GE C-Life Smart Bulb Setup,UCjMVmz06abZGVdWjd1mAMnQ,Tech With Brett,2019-01-16T14:00:03Z
bR63331fzBA,Google Home: Die wichtigsten Features im Überblick – TURN ON Spezial,UCip1RVSGWtkukxd0Am1NiRQ,TURN ON,2017-08-22T14:00:06Z
rhBReYMAyXM,Recensione Google Home Mini: COS&#39;È e COME FUNZIONA lo speaker smart con Assistant,UCC9qCcyZQ2ul_A9hX-6Yxlw,Everyeye.it,2018-05-07T08:00:04Z
Akt5Rjv2D6k,10 Google Home Features You May Not Know— vs Alexa,UCwOBG77Tm8cE24FPxHb_abw,Smart Home Solver,2020-02-11T23:24:24Z
Qyjf2gNq3Vc,Google Home Mini: Instalación y primeros pasos,UCe9KiXkD58tAvY5xfQ7Q98w,FAQs Android,2018-06-21T17:28:21Z
rQndE5zQyzk,La divertida reacción de una abuela italoamericana a Google Home | Viral,UCnsvJeZO4RigQ898WdDNoBw,El País,2017-12-29T11:51:10Z
TkBN0J5i2ds,JBL Link 10 And JBL Link 20 Review - Better Than Google Home?,UCW5cHxkagtxS59B48uvhHVQ,GYMCADDY,2017-12-04T22:00:04Z
0DOmnG8NCQA,HomePod與Google Home先別吵架，四台智慧音響比較一次看!,UCAr4MVsPBKjhg5eLDDpbDFg,電獺少女-女孩的科技日常,2018-03-16T07:50:15Z
Xxqc_-N26h0,TOP 3 COMANDI per GOOGLE HOME che (forse) non conosci!,UC7oeoeqraukaE8KFvCiFGQg,Doctor App,2018-04-29T09:00:42Z
AHRIcnBVvXI,Tu ASISTENTE PERSONAL en CASA: Google Home,UCok_yhjwg4WSx3s_2Yh8ZjQ,Topes de Gama,2018-06-23T17:30:00Z
azwdn9xKxcI,TRUQUES AVANÇADOS / DICAS para GOOGLE ASSISTENTE / GOOGLE HOME e CELULARES ANDROID!,UCDUdvPnNWjQCif_GnrhUE6Q,EscolhaSegura,2019-09-25T21:30:00Z
Ql9xZUp2jOI,8 RAZONES por las que deberías comprar Google Home en lugar de Alexa,UCe1FDuO_eqI4M9U9UyLBOhA,Just Unboxing,2019-12-12T17:00:11Z
A2R1JUGIYas,GOOGLE HOME HADER GULDBORG!?,UCb4MDdp49a-9zP9MIj24f6g,Moller,2019-05-10T13:00:02Z
fzC-rlrCvEs,Bliver Uvenner Med Google Home!,UCnKXl4f_8Timd6gdJcNh7sw,Benjamin Jønsson,2019-01-08T14:00:10Z
HbqQi1kbdIY,Google Home Mini Unboxing And Setup!(Tamil/தமிழ்)|Geekytamizha,UCZj7TPWYy-bxVoFukc3V2zQ,Geekytamizha,2018-05-20T09:30:00Z
Mx6YSWQlBJE,Google Nest Mini (2nd Generation) Unboxing | Google Home | Tech Unboxing 🔥,UCp3T5fUUJootTrVwGDdY6pw,Tech Unboxing,2019-12-05T15:00:05Z
tS-LP9FTmKA,รีวิว Google Home Mini ฉลาดจริงไหม?,UCGcBG9gd_RUhyT4ramtsQ6Q,SUPERTOMMO,2017-12-23T23:00:05Z
YR5sUebaK1U,Google Nest mini 智慧音箱 會說中文的 Google小姐 售價兩千台幣有找！,UCAr4MVsPBKjhg5eLDDpbDFg,電獺少女-女孩的科技日常,2019-11-30T10:00:06Z
PVgFBcjBpMY,Family fun with Google Home,UCIG1k8umaCIIrujZPzZPIMA,Made by Google,2017-10-24T17:00:30Z
NH7HI2BW6aE,Read along with Google Home Mini and Disney&#39;s Little Golden Books,UCIG1k8umaCIIrujZPzZPIMA,Made by Google,2018-10-29T16:02:08Z
hoPCRgvI-yE,Choose a New Voice For Your Google Home,UCjMVmz06abZGVdWjd1mAMnQ,Tech With Brett,2018-05-10T15:08:06Z
w-O6jtPJN7Q,Control Any LED Light Strip With Google Home or Google Home Mini (Google Assistant),UC_elPuYZ3vWE0QV_WMnYoSw,TechBlock,2017-12-07T19:29:23Z
UiBhshQ0FQA,Google Home Max | Introducing Smart Sound,UCIG1k8umaCIIrujZPzZPIMA,Made by Google,2017-12-11T16:59:15Z
-bTsfJ5Fvp4,Get to know Google Home Hub,UCIG1k8umaCIIrujZPzZPIMA,Made by Google,2018-10-09T18:22:21Z
zsOmwD3Oa9A,Qual o melhor assistente virtual? Conheça Alexa e Google Home. Como fazer sua casa falar com você!,UCnGsz7oDyQd043fPpXaDV7g,Celso Zucatelli,2018-06-05T23:37:41Z
WYeGWKAIjBo,Use your Google Home as a Bluetooth Speaker,UCjMVmz06abZGVdWjd1mAMnQ,Tech With Brett,2018-08-16T13:00:06Z
Z5uPDvF-Gy0,Test du Google Nest Hub : tout ce que vous devez savoir,UCmgSIY2oqfRKNKDI2lrQH0g,Le comptoir,2019-05-28T08:59:22Z
ZZZC9Yety48,Tùy chỉnh câu yêu cầu và phản hồi của Google Home cực bá đạo,UCSeca92q0ZaRIcLOcsNsQyg,BanLinhKien.Vn,2019-07-25T04:43:01Z
f0abR0j8Z5g,تجربتي مع الإخوة الاعداء  Google home و amazon alexa ولماذا قررت ان استعملهما معا !,UCO58fldVogtwlz7c2PTeWrg,قناة المحترف | Almohtarif channel,2018-01-24T10:52:57Z
CSjBKfZJKwg,How to Connect &amp; Control TV from Google Home Mini-2020,UCzvmBKjsw19OY5RBauMtVpA,MJ Tube,2020-02-08T14:43:28Z
v6sR43O__8A,Google Home - Cum să-ți faci casa smart (Review în Română),UCibISIUAQA-V4tyoHU5nilw,Darwin,2017-02-25T12:11:36Z
H3QGhIyKrUI,Getest: hoe handig is de Google Nest Hub?,UCDmYblK8ScOM4LEfXCQNzCw,Bright,2019-02-13T19:48:52Z
vcU6eXY3v2Q,"AMAZON ECHO vs GOOGLE HOME, QUALE COMPRARE? rispondo alle vostre domande | TuttoAndroid",UCfzijU5thstIWeAQI4a-jag,TuttoAndroid,2018-11-21T19:33:56Z
RaG2HHfSVlU,Control Samsung Smart TV with Google Home (Mini) - No Chromecast Required.,UCk8WU5lvn-JNtGyUxhHm5dw,HelpCloud,2020-02-20T02:08:00Z
vCGZ-L-VccI,Configurar Chromecast 2 - Baixar Google Home,UCuOIKhzUsbZmhAw0XXvXJuQ,Olha que Fácil Tutoriais,2017-08-08T13:22:59Z
l7Ms4zRPndw,Configurações Básicas de Aplicativos Para Utilizar Equipamentos Sonoff - Ewelink - Google Home,UCf00lRemsQy57qQCFl6X-rQ,DIY - Faça Você Mesmo,2020-01-19T18:20:10Z
m5hiFurj7iQ,Google Home : Ça sert à quoi ?,UCaybrunQi8xWgPMgv1AYBHw,TheiCollection,2017-08-04T15:59:56Z
_y9QVyEb0N4,Google Home Hub Review - Honestly Underrated,UC7V6hW6xqPAiUfataAZZtWA,Android Police,2018-12-26T18:30:04Z
YPu1Wmxf9d4,Google Home New Update || Chorme Casting Bug Fixes ? New Experience,UC5RVdFbQPbpAhbYSspv_QQQ,Design By RPV,2020-02-20T12:48:28Z
UXy1mLmxi-Y,"Un enchufe inteligente con WiFi, control remoto, compatible con Google Home...",UCkdFXlSdL1cmYbpbry2wsdA,Alejandro Pérez,2018-07-27T13:26:12Z
0db9y-Ep_5Y,Google Nest Mini: de beste goedkope slimme speaker?,UCDmYblK8ScOM4LEfXCQNzCw,Bright,2019-10-25T18:57:10Z
_50mX5txyB8,Google Home in de woonkamer - Vraag het Google,UCIqEvFk7y5-VhSJopkjebMA,Google Nederland,2018-10-30T11:30:01Z
HmhJspoq1E8,Samsung Smart TV How to Setup With Google Home and Alexa,UCj2xtCfUX4tY0AouuOvEhNA,Geek Street,2019-12-27T07:00:02Z
EX8lkiXax_s,Google Home Miniがきた！我が家のスマートホーム化への道,UCLVkr1YnM_DdWtd0ZdWzqQA,のりごとー,2017-12-09T10:00:00Z
0O-CYBbW4Z8,Google Home Unboxing and Review in Sri Lanka,UCETxOvOv9_44-CUzsPlzyxQ,Chanux Bro,2017-05-01T12:02:17Z
S--FveQ5wRg,Google Home Hub - Top 10 Tips and Tricks,UCxT5mkudJ13rIQ9eB9zWHdg,Daniel Westow,2018-12-22T23:01:54Z
4sIfLeVzMxM,"Google Home | Hey Google, let&#39;s get spooky",UCIG1k8umaCIIrujZPzZPIMA,Made by Google,2017-10-25T22:07:46Z
h8Gc0wN6T0o,"Google Home, Siri és az OKOSOTTHON S03E19",UCRJovKcgUL7QumDE1YsLqzg,Magyarósi Csaba,2019-02-13T07:03:49Z
EU0vHTl9uFg,Apple HomePod vs Google Home Max,UCFfCqe7b9YiDk2ZiAG8UIGA,Flossy Carter,2018-03-02T10:16:55Z
85z8bxrH-d4,Google Assistant Accessibility Videos: Make Calls on Google Home,UCK8sQmJBp8GCxrOtXWBpyEA,Google,2020-03-26T19:41:27Z
T52Blhps_U8,Google Nest Mini 2 akhirnya Resmi di Indonesia,UCWnpibjY9_BoVROPa5PgRZA,TMgadgetID,2020-03-03T05:30:27Z
MwAEhYw1TC8,🔉 Configurar GOOGLE HOME MINI en 5 MINUTOS ! 👍 UNBOXING en ESPAÑOL 🇪🇸,UCW4GKAd8nUFjZG9fTdhfznA,Alberto TV,2019-07-05T18:00:05Z
cBwP4QGpUHk,Nest Audio review: Is Google&#39;s new smart speaker any good?,UCOmcA3f_RrH6b9NmcNa4tdg,CNET,2020-10-05T12:00:39Z
rlIw0AB-Ceo,Conecta tu Tv Samsung a Google Home,UC_I9I7SdgFLaBZDG0o6dxCg,FeliTech,2020-01-12T21:00:08Z
OFA7KG1SvUk,10 Funny Questions to ask Alexa and Google Home This Diwali | Hindi | Part 3,UCL5et1s49vM1uia_iEKbfwQ,TQnet,2020-11-08T12:46:55Z
kj8HCy7P0rM,"Google Home: Unboxing, обзор, МНЕНИЕ",UCY03gpyR__MuJtBpoSyIGnw,Droider.Ru,2016-11-30T21:47:34Z
72z8toaJmAw,👍ЕДИНАЯ СИСТЕМА УМНОГО ДОМА GOOGLE HOME + XIAOMI💥 НОВЫЕ СВЕТИЛЬНИКИ XIAOMI YEELIGHT🌞,UC0fMl-FpIznL85RjoaTtuXQ,Китай Г.,2018-11-15T13:33:30Z
_NYnMghf0fY,Lebih Pintar Mana Dibanding Google Home? – Xiaomi AI Speaker,UCfYbnuBqxaiuN97HOSuQ_XA,HEYRIAD,2018-09-17T13:20:08Z
BKGuoq9qdt0,Change and Adjust Your Google Home Hub Settings,UCjMVmz06abZGVdWjd1mAMnQ,Tech With Brett,2018-10-27T14:20:04Z
JVZgcsSVUvQ,Echo Dot 3  vs Google Home Mini - Was lohnt sich mehr? - Venix,UCHnFHitawGGUK8lJ86lOuOw,Venix,2018-10-27T07:30:01Z
vOR3YmS1_Ww,Google Home Hub vs. Amazon Echo Show: Which one is better?,UCOmcA3f_RrH6b9NmcNa4tdg,CNET,2019-04-26T22:00:07Z
XsMk2VDrypc,Las 5 rutinas que más utilizo con Google Home y Alexa,UCe1FDuO_eqI4M9U9UyLBOhA,Just Unboxing,2020-02-25T19:29:07Z
A9g7cVMSc3g,涤纶测评 | 电器合集--智能家电篇（Google Home、小米吸尘器、NEST、智能门锁等）,UCKB4yglMissJu2TwbLGCq8A,Vicky Soupsss,2019-02-26T13:00:03Z
aPyR7BjhLHI,Google Home Mini,UCoc_b6Mqp4dCM6yhuZEu6KQ,Tech Seekers,2018-04-15T19:27:45Z
mr8geZijSV0,Mon utilisation de Google Home : Chromecast et Philips Hue - Appartement connecté,UC_zfiJdVs7J4N_Aou5KGLEg,Frédéric JEAN,2018-11-25T16:00:03Z
tv_S_jz-Qg4,Mein Google Home Review!,UCF_n906__yoMtxZQtmqmZbA,iKnowReview,2017-08-16T15:00:08Z
saZAnt4i79Q,Google Home | Mirror Casting Problem Fix | 101% Working Trick,UC5RVdFbQPbpAhbYSspv_QQQ,Design By RPV,2019-12-30T15:30:39Z
2WszBbGB8ec,Google Home &amp; Assistant Updates - September 2020,UCJOl2JvledP26K2OQ_HLgnQ,6 Months Later Reviews,2020-09-04T18:00:01Z
qKysn4F21eQ,"Trên tay Google Home Mini, điều khiển nhà thông minh bằng giọng nói CỰC CHẤT",UCzysw4JlmrANVd-DB3GXbjQ,KTheme. com,2019-11-12T03:00:09Z
VMRYg1y536A,Google Home русский язык – mini умная колонка ок гугл ассистент на русском языке обзор,UCnsNJy1oeczhCdBz9Kbx9xA,voiceapp,2018-11-10T18:34:37Z
p1vFJdB19Sc,Google Home &amp; Assistant Updates - November 2020,UCJOl2JvledP26K2OQ_HLgnQ,6 Months Later Reviews,2020-11-06T19:00:10Z
dio_eeSmXbg,TABLET BISA NGOMONG? Google Home Hub Unboxing Indonesia,UCg_vCUNRzKCOLxrrZqrQ0Yw,Bestindotech,2019-03-26T11:34:13Z
Xvw2NyKf284,Google Homeに「うんこ」と言わせることに成功した,UC8g17oXkRt8buwQL8GU-NSw,ラムダ技術部 / Yoidea,2020-09-23T09:00:07Z
MNMEaDxmvDc,جوجل هوم ميني | حول منزلك لبيت ذكي | أفضل من امازون اليكسا؟ Google Home mini,UC5dfttydNOVPXRYc0q-g_Kg,Raqami tv | رقمي,2018-02-09T18:57:14Z
U1eM-jTM7VI,Google Home Recenzja | Czy ma sens w Polsce? | Robert Nawrowski,UC_3c7OVSqos7zLsa3Ulfq4w,Robert Nawrowski,2018-01-05T18:52:36Z
55yejDKaTis,I Did Some Fun with Google Home Mini!,UCpum5I3etoFHzp8ixpKuRmA,Tech to the Point - TTP,2020-01-08T15:40:09Z
OE9qy3LfswY,Google Home長期使用レビュー！致命的な残念ポイントも発見！【グーグルホーム AIスピーカー】,UCZQlwQQ9FA-npql7Y-djOGg,セゴリータ三世 / Segorita the 3rd,2017-10-21T06:04:14Z
g4W_FXP7Y3o,GOOGLE HOME MINI PORTUGUES COMO FUNCIONA ASSISTENTE VIRTUAL BRASIL,UCrbnZTc2tkOyhkV1wEnjgfQ,Afonso Alcântara,2019-07-01T20:07:23Z
5pc5lAqJsck,Des PRISES CONNECTÉES compatibles GOOGLE HOME ! (Configuration &amp; Test Complet),UCwF5e6Lxzb0juciU0MlT26g,EasyTechTV,2018-12-19T19:21:04Z
jmD4RfDDWgs,"Maison connectée avec Google Home, Philips Hue, Xiaomi, Netflix, Spotify, IKEA",UCxY2ehdFka1vxJ3hUNal9Lw,THE WALKING DAD,2018-06-28T20:13:54Z
PpvRMpzMUB4,Tinhte.vn - Google Home làm được những gì ở Việt Nam?,UCyQobySFx_h9oFwsBV0KGdg,Tinh tế,2016-11-25T10:01:27Z
bqZcv5vJkTI,Google Nest Mini: Můj nový chytrý asistent (Recenze),UCiYYrqaZBdyiJVM-TrFmNKw,GeekBoy,2020-01-05T15:36:37Z
y-H4-VNJ5q8,8 cosas que puedes hacer Google Nest Hub y NO con Google Home,UCe1FDuO_eqI4M9U9UyLBOhA,Just Unboxing,2019-07-10T16:00:11Z
uLX1gQP7BSU,Google Home (Mini) - czy ma sens w Polsce?,UCeJgcVy6kNxT_u5igtkbinw,Android.com.pl,2018-04-15T10:00:16Z
5-ZkiEZqto4,Chromecastとの音声連携はどう？スマートスピーカーGoogleHomeレビュー続編・Appleはどう競う？,UCCD76tKlE45u1YTX0cVh1OQ,Appleが大好きなんだよ,2017-10-15T07:30:00Z
c43nr5iBihg,Google Home Gør Mig Nervøs!,UCnKXl4f_8Timd6gdJcNh7sw,Benjamin Jønsson,2019-11-01T13:58:09Z
w7uZHmZUNio,Tips and tricks to get the most out of your Google Home,UCOmcA3f_RrH6b9NmcNa4tdg,CNET,2020-02-26T13:00:23Z
468UHQTQj3E,Google Home in Bangladesh,UCmeq8j7qx6o5AKKMW2rVoBg,Ami Babu,2018-01-26T15:28:27Z
D0OuDH0esUo,How Google Lost The Smart Home Race To Alexa,UCYLnawaM-36HncBBUeWrlGA,Paul Hibbert,2020-09-12T09:00:03Z
