videoId,title,channelId,channelTitle,uploaded
iNs7-Pk73vk,How To Play Apple Music To Google Home/Mini On ANY iPhone (EASY METHOD 2020),UCSR_CFy4WkAOkikxNOyHk7A,LimSanity,2020-07-27T20:56:59Z
ChzK19LPba0,Connecter une enceinte Bluetooth à Google Home,UCwc8ELDUDl6I8S_-L0RroxA,Formation informatique avec Cedric,2020-01-08T17:00:03Z
DKLutwy3mPw,Google Home Mini Features/ Hands-On [In the Philippines] (VLOG No. 7),UCHKTFCIf8s6dFfvTYq_M_5Q,WINvlogs,2018-07-21T09:24:07Z
-LH2_HL0uVU,Probamos el nuevo Apple Homepod mini ¿mejor que alexa y google home?,UCe1FDuO_eqI4M9U9UyLBOhA,Just Unboxing,2020-11-30T17:00:00Z
VPlM94a4fzA,"Mon appartement CONNECTÉ 2020 (Google Home, Phillips Hue ... )",UCkS6jlQ4RJTCdkzVCU2-FSQ,GeekEtc,2020-02-13T17:00:07Z
aPpKzpO1P4k,Come ascoltare musica SENZA ABBONAMENTO su Google Home! [Tutorial ITA],UCOIKmXmQjUsd3LZyboKzJxQ,Elia99Best,2019-08-12T12:00:00Z
xyrYazqXl7o,So sánh Google nest mini với Google home mini - Liệu có đáng để nâng cấp,UCFHQbiNnRaEUPLKBZ4xd0CA,Tài Siro,2019-12-31T09:10:40Z
HUe0drYv5ss,Google Home Mini || Η &quot;έξυπνη&quot; βοηθός που τα ξέρει όλα || Unboxing/Setup/Review[GREEK]-Worth Box GR,UCfvpojouCHeBqTL3kY6dIaA,Worth Box GR,2019-03-02T09:58:48Z
3OsquG0NgKo,How To Make Phone Calls From A Google Home Mini - Episode 2 (2020),UCmHO0Rw7nBFK2233om_vyWA,Tech Steve,2020-04-24T21:26:15Z
AgWMfOI-v2g,Kaufberatung Alexa und Google Home: Amazon Echo Show vs. Google Nest Hub vs. Lenovo Smart Display,UCXeBejAs0cIw4a3UFy1SuIg,COMPUTER BILD,2020-02-06T14:35:02Z
v3ywcJc4_HY,Instalar y configurar GOOGLE HOME,UCCEwPfv49j9zycREVqIzckg,Tecnoyfoto,2020-06-30T14:00:14Z
l6hAc-h4X3I,Google Home Mr Satoshi Easter Egg - Check Bitcoin Cryptcoin prices,UCv-oD6ybWSmq1hh6ZHlZGlA,LebronJames,2017-12-13T05:59:31Z
HAttxtpK470,RECENSIONE Google NEST AUDIO (vs Google Home),UCohqjDGw0sKlUha-eV1J0hQ,AndroidWorld x SmartWorld,2020-10-05T12:00:04Z
AAfiOVsWKto,Lenovo Smart Clock vs Google Home Mini 2020,UCL5et1s49vM1uia_iEKbfwQ,TQnet,2020-01-04T13:27:42Z
QkX0mTvKoKM,Google Home dan Google Home Mini Sekarang Bisa Bahasa Indonensia. Ini Cara Setting-nya,UCWIrJGI7zfeLEeDbcaMyVuQ,Mr Bibbo,2020-01-25T01:51:24Z
AkI-3RY_Gz8,Google Home y Samsung Smart TV + Tips,UC0hZV3JbWw6fup0gdUYCdCw,Automatizame,2020-06-12T19:00:00Z
M78eIFEebpw,Google home mini do czego ja wykorzystuje najtańszym kosztem,UCdTW_IVUgfbWHhJd9zTK_8Q,Adam Dors,2019-03-01T16:42:51Z
iUnt_20XRUQ,GOOGLE HOME MINI em PORTUGUÊS - Unboxing e Primeiras Impressões,UC3A0_kgXY7jvRElaiTF3U4w,Filipe Covas,2019-04-12T14:00:10Z
FLpQ1yPwJ78,Amazon Alexa ou Google Home - Qual é melhor? Por que troquei de assistente?,UCFPsz4FkYG1sxU0CYdcIquw,Canal GeekTech,2020-03-26T21:00:03Z
N4pAj0wldjw,"Google Home Mini India Review, Unboxing and Setup",UC4UsQjM_Av1Ke2FEfBh-l8g,Ankit Garg,2018-04-08T20:54:34Z
OGjsQVuqTxE,Conecta tu TV con Google Home muy fácil ¡2020! 🔥 Configuración,UC0wEXkqp19pj1g66x7G7FnQ,Julio Tecnología,2020-07-24T13:33:47Z
rlhHpOdrhG8,Alexa vs Google Home | Qual a melhor assistente?,UCHPr0Bgn-HWPM7sordchlLA,UNDRE - Unboxing & Reviews,2019-02-07T20:30:00Z
KiInee3thi8,BSTControl - Bose SoundTouch with Google Home,UCDxByNdpjQaOkasCuwBi6Yw,Andy Lyonette,2018-03-07T16:16:32Z
oNrBlTvU8xc,"Buka kotak Google Home Mini, Speaker Pembantu Pintar | smashpOp",UCfbaMl4Z8ohofeZWHKXtAnw,smashpop,2017-11-26T13:46:01Z
_dU5LCdvpuE,Use your Google Home Mini as a Bluetooth Speaker (No More Casting Lag!),UCZ0hznff92f_i1wpYyi7tPQ,MikeTheTech,2019-09-14T22:51:33Z
rcPv0Hw2VcA,Hindi || How to Connect &amp; Control Android TV from Google Home or Google Home Mini,UCYA5bVKBLcMKQRsLkQuUi5A,sahoo techno guide,2020-08-21T10:06:35Z
OZ97U_JwIyk,Google Home Mini meg minden más,UC72B8SLARBBKaCfy0Gflpxg,MAGYAR KÉPMESÉK,2018-02-06T16:00:02Z
ddUZOQuWCX8,วิธีต่อ Google Home เข้ากับทุกอุปกรณ์ IOT | Smart Home 101,UCFNhJnHdxdaQs1ZV9pUQ6TQ,THE HYPE TECH,2020-05-09T02:00:08Z
Jczj5HlbInI,Sound Comparison of All the Google Home Speakers,UCjMVmz06abZGVdWjd1mAMnQ,Tech With Brett,2020-10-21T13:15:01Z
NnrAaMQ8Wnw,Google Home Miniで「ピカチュウトーク」やってみた！,UCMZuF3aPUQOFkz8tXDlVoJg,mamesuke,2017-11-11T11:52:56Z
JZ-MNPRRYu0,COME CONFIGURARE GOOGLE HOME MINI installazione e impostazioni base,UCdUVPNoYGWmxJXQCNpBAznw,Recensioni per Scegliere & TRAVEL,2020-03-25T11:00:07Z
9H4_5yLwxzs,Inkbird ITC 308 WiFi Smart Thermostat | Review and Automation with Google Home and IFTTT,UC0XQHkkvlwwbP8HcO2rpGqg,Short Circuited Brewers,2019-10-13T20:27:33Z
KqSdPFykfxY,Co potrafi google home mini,UCXtCD1Y3rjbVrTVbalubkxA,Niezależny,2019-11-27T05:44:24Z
GIP3Yjtayu8,Google Home Mini İnceleme - Akıllı Ev Asistanı,UC5QQbffkOhjTYtrZR7Vwb8w,YapalımTube,2020-06-04T19:14:26Z
X8sqACdPFKY,How To Add Free Music To Your Google Home Mini - Episode 3 (2020),UCmHO0Rw7nBFK2233om_vyWA,Tech Steve,2020-04-28T03:19:00Z
bSktO8M_lno,HOME MINI by Google | REVIEW y EXPERIENCIA DE USO en ESPAÑOL [CHILE] 🇨🇱,UCCg1cx4qDuCDmr8OqURKX6Q,LaJoseVlog,2019-09-03T01:00:05Z
s0FI94cDpzM,How to connect Roku to Google Home,UCRqGXMuQO0vZSYg6nhOJNgQ,Knowledge Sharing Tech,2020-06-06T14:43:44Z
MssbIbFyiXo,SONY LF-S50G ( avec Google Assistant): Meilleure que la Google Home?,UCsIR59r1Nh1FTspIigtS9OQ,Kailtech - By Kaily -,2018-02-18T21:11:33Z
9meNKZ3hKN0,So richtest du dein Smarthome ein! | Das Große Google Home (Assistent) Tutorial (Google Life #17),UCUkakShJ1faFn1mgZfnICaA,Simon,2018-07-16T13:00:00Z
mFbSp9sZLuY,The Latest Features and Updates For Your Google Home (And Nest)!,UCtRSKEipM17PF7n0mi66btQ,Automate Your Life,2020-11-28T15:00:17Z
Sbx-9oHZFes,Google Home Mini vs Amazon Echo Dot en Español,UCDYztd4ex1vmvGbdp73LzCw,tecnoduda,2018-04-28T02:49:28Z
Nkl7JGut6I8,Google Home: Lançamento de 2 novos dispositivos de Casa Inteligente - NEST AUDIO e NOVO CHROMECAST,UCJVNMCRyqNf2ETPbLNoWp8A,Attilio Catalane,2020-10-03T13:00:15Z
fISNcL7AldU,Google Home Mini Unboxing+Review In Pakistan!!,UCX9qJR7Ray1dEOM4Ph8MWgA,Khalid Technical,2018-12-08T10:00:06Z
liL_-LI3X-0,"Обзор Google Home Mini - [Русский язык, Google Assistant]",UCK6S9iQVET1NLsl3LkkZ2kA,Кристина Line-Power,2020-03-17T08:58:33Z
hRVlQ05Jve8,How to control your Nest Thermostat from the Google Home app,UCWmlRLAOpx9f1t_cVkBx8-g,Google Nest,2020-10-12T14:21:21Z
2PAOG7kb5rU,Google Home Mini vs. Amazon Echo Dot | Vergleich Klang/Soundqualität und allgemeine Fragen [DE],UCvWbhB2qgJiIzkkP47UDJUg,Gadget des Tages,2017-10-26T20:41:26Z
whmn_M-kYmY,Two Steps to Connect BARDI App with Google Home,UCrrfeBEYp-9IjoA0rLnJ9Fg,Bardi Smart Home,2020-08-21T06:54:27Z
qjrVPPnbLZo,Language translation using Google Home,UCtgzyENX5nwN_hgzAUBMJrQ,Ivan Yudhi,2016-10-05T05:38:32Z
rXkw4u2Ysiw,Welchen Google Home Speaker sollte man kaufen? - Der Vergleich,UC_uvNJNLvhep7xJ1XGVWDIg,Techniklike,2019-12-20T15:02:40Z
GQ8rTzdHOlo,Cài đặt Tiếng Việt cho Google Home,UCUMy9tsZz0yuz3dZjJms9-w,haloshop. vn,2020-01-10T11:52:51Z
qdE8Md_dIJc,【科技狗評測#6】Google Home 智慧音箱開箱 音質比拚 feat. BuyandShip ｜Onkyo VC-GX30 G3 、Google Home、SONY LF-S50G｜,UC5r-9EMDERXlUni-UWAtTdg,科技狗 3C Dog,2018-11-24T12:55:27Z
Pfa5gqZK8dk,AKILLI EV BÜYÜK KONFOR (Alpsmart Wifi ve Google Home Mini),UCVgYFoitcj7GnG_6c3v4Slg,Mithat KILIÇ,2019-11-25T16:35:07Z
13Cq0nUEg8M,Google Home con Bocinas Bluetooth 🔊,UC0hZV3JbWw6fup0gdUYCdCw,Automatizame,2020-05-02T18:16:37Z
MDNDfi5-3qM,Google Home - Mon utilisation 2 ans aprés,UC3bJwKm5UZ4FgjXz86cTVbg,Alexis Pineaud,2019-06-09T12:37:56Z
iY1H8AHD0M8,Reinitialiser Google Home Mini (reset),UCwc8ELDUDl6I8S_-L0RroxA,Formation informatique avec Cedric,2020-01-22T17:00:11Z
Oz9sZC2_kPs,Google Home Akıllı Ev asistanı - İNCELEME,UCVpQ2ewPkKGEn2q4_IV3Leg,POV TECHNO,2019-04-21T16:05:48Z
Vq_tcdu_A8I,Mira como controlar tu LAPTOP con GOOGLE HOME 💻🔥,UC_I9I7SdgFLaBZDG0o6dxCg,FeliTech,2020-06-15T22:04:08Z
ZmoLqaFm28U,Google Home Max Review -  Googles großer Lautsprecher,UCBhIvY0GdaK8Wc-5WWv8Kjw,tink GmbH,2019-12-10T16:00:05Z
DirpCVAaLsE,Affordable Smart Home starting at 499 pesos! - Google Home / Alexa,UCdEYTKo_rNGbmc32dem2EQw,Hungry Geeks,2019-08-26T10:00:16Z
Zvr4I_IXRk0,How to control your media with the Google Home app,UCWmlRLAOpx9f1t_cVkBx8-g,Google Nest,2020-10-05T20:52:42Z
_JPIz4_EQVU,Google Home Mini Vale Apena ?,UCFD0BfdC-XlfUuYEisU-ANQ,luiswong1997,2018-12-11T05:26:12Z
8Db1VQhBPvA,Google Home Mini en Colombia: ¿para qué sirve? | Google Home en español,UCjHYrUDsaHh1EQm9WhL3XuQ,Nubeléctrica,2019-11-05T15:00:05Z
3IhFPJoxme8,"VLOG DO FDS | COMPRAMOS UM GOOGLE HOME, SESSÃO DE FOTOS EM UTRECHT E COMPRAS BLACK FRIDAY 😍",UCKXi9hkh4wiU4eLM-HTWEfg,Natasha Salvucci,2020-11-25T21:32:49Z
cxNGhyVwIfM,HomePod Mini開箱🌟 Google Home Mini跟HomePod Mini要選哪個🧐｜HomePod音質到底有多好👀｜2020果粉必備單品🍎,UCGLOmkdNaAa2cBU-DTPVrjw,kk. chiao,2020-11-25T13:30:06Z
Ph-yZEd1_O8,130 บาท เปลี่ยนไฟเส้นธรรมดาให้อัจฉริยะรองรับ Google Home สั่งผ่านเสียง เล่นตามเพลง เปิด ปิดผ่านแอป,UCbkVXXF6haOHCY5LZOZktPA,Mi More,2020-12-02T12:34:19Z
2PTfToww51A,Hvornår er du rig? Google Home svarer på spørgsmål om penge (overraskende svar) feat Økonomichefen!,UCunzRLkB0cWbGaWdxfiC_4w,Daniels Pengetips,2020-11-30T18:00:00Z
XIgrLvY3TO4,Google Home automatically announces weather every morning when you wake up,UCCl11_iYjid0YrT7d8DF3-w,Net VN,2020-11-24T14:15:47Z
C0Wvf2LMJbo,UN NUEVO ROBOT EN MI FAMILIA - GOOGLE HOME VERSUS ALEXA,UC4WVwyXjGumv15iCofZHOsw,TEKIBOCAS,2020-11-25T23:30:00Z
LCWAlp49Opg,How To Connect Ecobee To Google Home,UCdmyYTlRW9kIn67GBZfFHvw,One Hour Smart Home,2020-11-25T16:30:00Z
OvP97Tm8DK8,Google Home svarer på spørgsmål om aktier og skat (Overraskende gode svar) feat Daniels Pengetips!,UClCQ5PBTY4ecc6PU5y5ysLA,Økonomichefen,2020-11-30T18:00:04Z
756qYJ1GEOM,Google home + nuevas rutinas + nest,UC0hZV3JbWw6fup0gdUYCdCw,Automatizame,2020-11-02T21:30:01Z
Ggi-kP7-16s,"Google Nest Mini 2 Unboxing, Einrichtung, Funktionen",UCrJAq6jMffl2FSRwq6GRYhg,Woid,2020-11-26T18:39:25Z
1taCmVdTS8Y,Configura una RUTINA en tu Google Home para la Hora de DORMIR 😴🌛⭐,UC_I9I7SdgFLaBZDG0o6dxCg,FeliTech,2020-11-23T19:06:51Z
1dlMdWyecs8,Yeelight Smart LED Bulb x Yeelight Lightstrip Plus x Google Home Mini - Nice Home Ambiance to Relax!,UCavnECZdEPVno2ZsYEpQQLQ,Xiaomi Review,2020-11-30T07:40:40Z
eCFI_mJEIv4,"Hey Google, hvor er det billigst at købe aktier? (På Etoro???) Hvordan beskattes en Aktiesparekonto?",UClCQ5PBTY4ecc6PU5y5ysLA,Økonomichefen,2020-12-01T18:00:09Z
Fr6vTgCA2B8,👩‍🚀 Contrôler sa Xbox Series S avec Google Home ! (Compatibel Xbox Series X),UCrrXYo8N0r26rrPrAcLAuNA,"Otakugame.fr, le blog 100% otaku !",2020-11-26T23:46:22Z
yQ52znVE5Ic,Bliss 2 | termostato smart - compatibile con Google Home e Amazon Alexa | Finder,UCXssF29ENnCC2QRKL-jpeBQ,Finder Italia,2020-11-25T14:45:25Z
hxCrd3Z2I3w,How To Model Google Home In Blender 2.91 | ( Modeling &amp; Texturing),UCWcyRLnJ6q9jyH_R6ocGrYQ,Deepak Graphics,2020-11-26T14:11:20Z
LmNhzRB15h0,"🚗💨 Hey Moogle, wie fährt sich der Mercedes?  🤡🤡 Google Home  | Sabine und Dirk Ferrato",UCrFEJnABsFbIUo2YPdrnBUg,Dirk Ferrato - Bavarian Explorers,2020-11-29T17:30:01Z
M5TYmo6NjK4,How to Connect Samsung TV to Google Home Hub via WiFi Network,UCXO2z5cJMuY5ooJP7aS6b9Q,Poolarity - Life Hacks,2020-11-24T08:35:00Z
1vu53R7R29g,"Daha Akıllı Bir Ev için Kasım Ayı Alışverişi - Perde Robotu, Google Home Mini ve Daha Fazlası",UCO3d8k8DMCSA_6TekCCuL0A,Bora Akıllı Ev,2020-12-01T09:00:00Z
tyUBseS0Lm8,How To Connect Google Home Mini To Mobile Hotspot | Google Home Mini ko Mobile Se kaise connect kare,UCdnNcyp5aBIhVPfvkY6JdLQ,TECH N TRICKS,2020-11-25T16:00:33Z
wcq5f4roJd0,Unboxing del Google Home mini y &quot;recomendaciones de cuidado&quot; 2020🚫,UCWDGmbEn3cRpGZj_VQkrukg,Facade Casual,2020-08-15T01:34:40Z
iUpjS1knwl8,APP Smart Life 7. Escenarios inteligentes Alexa - Google Home - Siri,UCB8avlzmuhsPPn69E1VyPmQ,Si Smart,2020-11-24T17:11:09Z
e_zEzTu6Vq8,Google Home Mini VS Google Nest Mini | 10 principais diferenças e qual comprar,UCXxnOtOrftCvso0WOwOsklQ,Catarina Mouro,2020-11-29T21:13:37Z
mHnafCJqij8,PURIFICATORE D&#39;ARIA SMART con ALEXA e GOOGLE HOME - Proscenic A8,UCdUVPNoYGWmxJXQCNpBAznw,Recensioni per Scegliere & TRAVEL,2020-11-23T23:00:09Z
t3lBvOjv-pY,Do Smart Light Switches Work With Alexa and Google Home?,UCdmyYTlRW9kIn67GBZfFHvw,One Hour Smart Home,2020-12-01T16:30:01Z
UGlm9QLKIYc,Google Home Mini Unboxing and Setup Tutorial | Reyzz Tech,UC3YnCZWdh3Mu4mC657hM9ZQ,Reyzz Tech,2020-12-01T15:41:57Z
DS0VbO2T3KQ,HomePod Mini Update - Goodbye Google Home!,UCaPXpkE8tUhImmE6X6LgENg,Drew Lipps,2020-11-29T21:22:04Z
tjPu9OYSZc0,Automate your Smart Home Tech for the Holidays Using the Google Home App,UC_JTai-FQ09tVB1_TeO9u7w,JoJo the Techie,2020-11-29T01:00:53Z
Gg1EylssroM,Google Home vs Alexa: Is $1M A Lot Of Money?,UC4wBPUcZUvBM4a5IuIHr9gQ,Google Home Vs Alexa,2020-12-01T19:25:21Z
IcsYJhIH1Fw,GOOGLE HOME MINI*  Unboxing- #18 ABRINDO BRINQUEDOS E PRODUTOS DO JAPÃO,UC4_UO1e_FUR7-fIsjls2jCQ,BRENO AIRY NO JAPÃO,2020-11-30T13:52:19Z
lgPXPvQxvMk,Funny Food Timers to Try with Google Home Nest Hub on Holidays | MashTips,UCCa9-KU20Vwp78SNuegodCw,MashTips,2020-11-26T13:04:24Z
djoFZpIhr8I,Control Your Smart Home AUTOMATICALLY with Google Home Routines,UCk8WU5lvn-JNtGyUxhHm5dw,HelpCloud,2020-12-02T13:45:01Z
ccnV3HdOR4I,Google Home vs Alexa: What&#39;s the Fastest Way to Make $1 Million?,UC4wBPUcZUvBM4a5IuIHr9gQ,Google Home Vs Alexa,2020-12-02T21:38:23Z
argzSEQspPY,Google Home Mini Unboxing 2020,UCvbiBxIHmmiQIoV40wR22tg,Greg Wootton,2020-11-29T13:49:29Z
NfnqLG9RCQ4,Alien Cube: 3D Print + Arduino + Led + Google Home Compatible // Stampa 3D - Cubo Alieno,UCGze6RWuymjULfJo_TCeweg,Il Pulla: 3D Print for Beginners,2020-11-20T16:18:33Z
t1qN62c1jJY,Alexa vs Google Home: Asking Alexa and Google Home Who&#39;s Better Device,UC4wBPUcZUvBM4a5IuIHr9gQ,Google Home Vs Alexa,2020-11-30T23:26:21Z
K48GEaVNtqU,Google home  Smart home,UCE8gehJg4E0H2Eb9pUEIpbw,Domotique lumiersof,2020-12-02T15:10:55Z
DXoyQZ7x6Ao,UNBOXING GOOGLE HOME AND PHILIPS HUE LIGHT*SO COOL*,UCTfk5DGN9-WfshwvvlsZoTQ,Bisayang Danish,2020-12-01T19:39:15Z
LyrWMTOVRMU,My Google Home is Jealous of Jamaican  Alexa - LOL,UCmXfnWBDHoIGUU-NXsSOjeQ,wayne's new world,2020-12-02T18:52:33Z
GjQkQ-753ac,Send Info From Your Google Home Speaker to Your Phone,UCNK4K8ce_dbhBs01o8UB77A,SMARTLIVINGPH,2020-11-24T02:00:00Z
AE-7F0PjkUg,LUMIMAN Smart WiFi LED Lightbulb Alexa | Google Home Assistant Compatible,UCv0dQsAovlqc6EONr-nCCsQ,Real-Life Unboxing,2020-11-29T18:19:27Z
EQc06INr81o,Google Home Mini - مراجعة لاختراع بقاله اكتر من سنتين,UCDa7ZkgMSat0vyB9J8lQVFA,Karim el sharqawi,2020-12-02T18:00:08Z
yVx5zUuRRdM,J&#39;INSTALLE MA GOOGLE HOME ET MES PHILIPS HUE !,UCaR_OqtMFPDd2xFAudLw1SQ,Sylv1 Prod,2020-12-02T13:00:15Z
YEeo7ti48UY,Does the Google Home mini work when plugged into a computer?,UC53Yii8B1PkpwaKjWovmBxg,XM9G,2020-12-01T20:38:47Z
f-5OKn7mhgQ,nuevo video con Google Home mini. ft Google,UCpbtT6QOFx-d8yObgHStWjQ,malenca gamer,2020-12-02T04:17:29Z
ORqWwjizaGc,Google Home Mini,UCbNChV8JchnsfxczsBshHqQ,Sofproc TICs,2020-12-01T22:00:23Z
3R5N9iSStUE,Set up google home mini.,UCh0ZCIunSmsZ5fLaJoIth3Q,George Robidoux,2020-12-01T10:13:48Z
nMxjHSo4qa4,Ahora puedes darle ordenes a Google home para que Ejecute lo que dices hasta 7 días después.,UC_abYWqIruUTABf0aupyo5g,luis felipe camilo mercedes,2020-11-24T02:15:08Z
k2IFnR8UCk4,"cara screen mirroring dari hp ke tv tcl dengan google home di semua hp,mudah dipahami",UCj5zmPLs1HbcHxQZZASR8aQ,ARYO ABIMANYU,2020-12-01T04:01:29Z
biQg0dxuT10,"MEROSS Presa WiFi Esterna Multipresa Intelligente, funziona con Alexa e Google home da Giardino IP44",UCcskBLVgSBZsDTb0z2bPcDg,Lo Testo x te - new,2020-12-01T10:37:03Z
MMSZsW2G22c,Should you buy the Amazon Echo Dot or the Google Home Mini,UCt_TNQZFMb6zXAwIJRfHtag,Jean's Tech World,2020-11-29T17:26:42Z
_Mh0q5BNPMw,Небольшой обзор  реле  купленных на aliexpress для Google Home,UCVGm6UDG7gqMc64aDOr65Sw,Sergey Musin,2020-12-01T12:12:58Z
H03-6pJDtS0,"How To Use Guruvaani  App , in Google Assist / Google Home",UCejEaR7weZFuNZFKW489RLg,Jigisha Kaur,2020-11-30T09:12:00Z
zBnrCi3Kgs4,Test du google home,UCZtcJlnZfeVGwmFR8JGlBBg,Mr Automatisme et domotique,2020-12-01T21:39:17Z
2sIZ_yEpJMo,Google home mini Unboxing | The best compact assistant,UCGEfBD5ox0NBRvyOpXS2orA,Tech View,2020-12-01T16:12:31Z
yl2JNWYdceM,Google Home Part 1,UCim9iu5k6CZeoTSav_t7_Sw,Spinolion,2020-12-01T02:59:47Z
OiGKA3cnU2w,How to Setup Any Google Home Speaker,UCvbiBxIHmmiQIoV40wR22tg,Greg Wootton,2020-12-02T13:59:09Z
g_djwoUTbC0,Google Home vs Alexa: What Is The Toughest Task On Earth?,UC4wBPUcZUvBM4a5IuIHr9gQ,Google Home Vs Alexa,2020-12-02T19:21:39Z
e38uWQxjS88,REDO! (Huawei Matepad and Google Home mini Review),UCXCw3coUXUxoc1bGoJDN6Vg,TheTechLegend,2020-12-02T18:34:01Z
U1vqwOmPZP8,DOMÓTICA #2 | Tu casa conectada | Toldos Valls + Asistente de Google (Google Home) + SOMFY.,UC6Q1G96QNcMs5WFqB2wrmaA,Toldos Valls,2020-12-01T22:34:55Z
gtgfA-Cbqco,google home vs alexa quale scegliere?,UCPidKVEaH7XvsCjpN1vRJBA,Ale Junior,2020-11-29T14:25:22Z
yY1BmUGri9M,Reset Google Home mini.,UCh0ZCIunSmsZ5fLaJoIth3Q,George Robidoux,2020-12-01T17:50:37Z
dv55FrCH0nk,❄️ 2PCS Mount Stand For Google Home Mini Nest Mini Voice Assistants Compact Holder Kitchen Bedroom,UC3kpdn0Mr9Lh4zpFYm1fZfg,Matthew Radley,2020-11-20T07:35:11Z
2Bt3xIAGsh4,Arenti Laxihub Cameras Pairing with Google Home,UC4gOx7_7rDE6pJj116MgWsQ,Arenti Official,2020-12-02T15:20:35Z
LmLfchXawls,Google Home Hub Review,UCniIex_rbyPNp2zfRZNpqjg,Noah's Tech Review,2020-12-01T22:02:36Z
L6rDSDHAzoI,Google Home vs Alexa: What Are Humans Most Scared Of In Life?,UC4wBPUcZUvBM4a5IuIHr9gQ,Google Home Vs Alexa,2020-12-02T19:05:23Z
y3n5GYpB_sU,Lâmpada Inteligente Alexia x Google Home,UCGMSWpN_eTXpoU6adgzMJeQ,Ladefora - Produtos Fantásticos Internacionais,2020-12-02T19:14:35Z
90mFdq_wypA,Connect ROKU TV TO GOOGLE HOME,UCWG96y_kORXBTa58fbhm3XA,KDPRODUCTIONINC,2020-12-01T21:52:17Z
pqsRfy9Kp_4,Set up google home mini.,UCh0ZCIunSmsZ5fLaJoIth3Q,George Robidoux,2020-12-01T17:54:07Z
j4fPM3Hk2A8,Google Home Mini Clock Stand 1,UCjkhnzugIya1UdsLYWh08qA,Yet another 3D Printing,2020-11-30T21:54:36Z
6EknBTi9Cyk,Google Home vs Alexa: Who Is Your Father?,UC4wBPUcZUvBM4a5IuIHr9gQ,Google Home Vs Alexa,2020-12-02T20:03:39Z
qAkLzH_71ko,WiFi Switch Google Home Alexa Tuya Smart Home DIY Light Mobile Remote Control Timer 10A  2 way work,UCTxVTb3PAoYNEM4RHe17h4g,Leo Gran,2020-12-01T10:27:56Z
MNh9AJMuhKo,How to cast mobile to TV with Google home ✓,UCstt6KMTpIlXAMz1Oe2Bfmg,K CREATIVE TECH,2020-12-02T13:46:53Z
pWDqV23irJc,Google Home vs Alexa: Do You Like Jeff Bezos?,UC4wBPUcZUvBM4a5IuIHr9gQ,Google Home Vs Alexa,2020-12-02T20:09:49Z
q7gJ7qX-Bw0,Luminária Inteligente Alexia e Google Home,UCGMSWpN_eTXpoU6adgzMJeQ,Ladefora - Produtos Fantásticos Internacionais,2020-12-02T19:04:19Z
spArbKWOVdI,How To Reset Google Home Mini 2nd Generation - Credit Mayank Aahar,UCZVkTuv_HdqKK9x9id4Gr6g,shilpa tanwar,2020-12-02T05:36:47Z
ftoRj-XzxmQ,Google Home Mini &quot;nevermind&quot; Glitch,UCYJKu8D7KQQjyVcviaot4Yw,Loose In Space Again,2020-12-02T03:15:02Z
8KdwiMA7XGI,Google Home vs Alexa: Will AI Take Over The World?,UC4wBPUcZUvBM4a5IuIHr9gQ,Google Home Vs Alexa,2020-12-02T21:21:35Z
PlMZG1FYXdc,Google Home vs Alexa: What Can You Do With $1 Billion?,UC4wBPUcZUvBM4a5IuIHr9gQ,Google Home Vs Alexa,2020-12-02T14:42:36Z
W1noFLgkxz4,My Google Home First Look,UCeGc6kx26z3TentfjvW-syg,Atticus James,2020-12-01T00:00:09Z
L7YwBOmGgfM,Gratis download APK Google Home,UCo460Z87IpOZzRzC0daLOtw,Linnea Mathisen,2020-12-02T02:14:15Z
r3XoguzTID8,✨ Smart Wifi Press Curtain Switch Mobile App Control Support Alexa Google Home For Electric Motoriz,UCxf7089_ItE36puAnE4lOsQ,Elaina Easter,2020-11-30T01:56:50Z
5IWiWu6eeD8,☄️ 2000K/7000K Smart Wifi LED Light Bulb Smart Home App Control For Amazon Alexa/Google Home Work W,UC6rvbanBvmyOVa3UezEZTsw,Daisy Martin,2020-11-30T02:07:06Z
dKZL3MdVh2M,Termostato Digitale Programmabile LL0253 Compatibile Con Google Home e Amazon Alexa,UCT2Z-W6MnO4yAHUMgqiCYpQ,Ledlux,2020-12-02T15:18:05Z
4oGR6xFZtOM,how to change the image in google home screen UwU,UCphulcEKatb2J1sQ9JCjniQ,ʟᴏᴠʟᴇʏ ᴛᴏɢᴀ ʜɪᴍɪᴋᴏ •-•,2020-12-02T11:00:23Z
4f4hAk51g5s,25  Controlar o domovea com Google Home,UCpKNqK7kRH0JauKT8prRhJQ,Hager Portugal,2020-12-02T11:37:12Z
