videoId,title,channelId,channelTitle,uploaded
-YPGPr7gPN0,Google Home einrichten und erster Eindruck,UCtVRqyK1SGKqOlER5-mnKZQ,Technikfaultier,2017-08-08T20:38:00Z
wZG1c2zItRU,Google Home / Home Mini: unboxing e prima configurazione,UCog4OxFFbS9vF4G6rPCueoQ,SmartWorld,2018-03-23T16:00:06Z
2uJ-D8LwKXA,Google Home / Alexa Wifi Blind Motor For Chains &amp; Cords,UCYLnawaM-36HncBBUeWrlGA,Paul Hibbert,2020-05-23T09:00:02Z
fQip28zZ-L0,TRUCOS SECRETOS DE GOOGLE (HOME) 😱 ¡Esto ya parece humano!,UCwwnVTaTXevgCfVzdpYgDXw,SerCompatriot,2020-07-31T23:22:38Z
Ey4SjKsjt6k,Google Home Mini İnceleme: Ucuza Akıllı Ev!,UCBlp-c5n6Fi5eLFOQONEPTg,Onur Alp Aydın,2018-03-25T10:10:03Z
B7ty-sHL8Wc,超実用的なGoogle Homeの音声コマンド10選と便利な使い方を解説【活用方法】,UCzmxo1Zj4KkM32FlObFWdeA,トーマスガジェマガ,2019-10-23T10:00:02Z
-ksr9uYFLKM,Uitpakparty Google Home: hoe slim is de Google-speaker?,UCDmYblK8ScOM4LEfXCQNzCw,Bright,2017-05-19T11:45:57Z
gUv3a4Pg9Xs,"1) Sistema de Domótica para Hogar - SonOff, Google Home",UCBJZdf7U-rOH92vIFESj14g,INNOVA DOMOTICS,2019-01-21T21:37:08Z
b5aW9vcFgnE,Amazon Echo Dot (Alexa) ou Google Home: quem é melhor em português? [Comparativo],UCgETm7UcdKbQptb3gIQG4HA,PCWorld Brasil,2019-12-10T21:25:42Z
Rqx7DIT1aJM,The Google Home Hub Ultimate Setup Video,UCtRSKEipM17PF7n0mi66btQ,Automate Your Life,2018-12-14T18:00:02Z
NBemX2KP_OY,Google HOME vs Home MINI: quale comprare?,UCog4OxFFbS9vF4G6rPCueoQ,SmartWorld,2018-03-25T07:30:02Z
KchnlCmS5po,Comment Réinitialiser Reset Usine Google Home Mini En Quelques Secondes !,UCVHeb0aSwL7p_Njrx10z0yQ,Vision High-Tech,2018-03-01T07:44:51Z
CUrv5aTWNrY,"Así son los Google Home y Home Mini, ALTAVOCES INTELIGENTES",UCQSLny1RMIQ0jTp0o8h0yPg,Orange España,2018-08-01T10:02:00Z
EGakW4VMgMM,4 diferencias entre Google Nest Mini y Google Home Mini ¿merece la pena el cambio?,UCe1FDuO_eqI4M9U9UyLBOhA,Just Unboxing,2020-01-21T17:00:06Z
d1BqV3j5C8w,Kom igång med Google Home på Svenska,UCqXuci_aErWTAeOB-NlCFsg,Teknikveckan,2018-12-24T23:19:44Z
TXnhmEV-7Cs,Google Home Mini in Sri lanka,UCETxOvOv9_44-CUzsPlzyxQ,Chanux Bro,2017-12-14T13:17:20Z
H7MRy1tP_Ms,Alexa vs Google Home Routines – The Winner is…,UCFLyvD13JJG7gXrCmbK8uJQ,Craig's Tech Talk,2019-06-22T20:55:22Z
emWw0h897DY,ASSOCIER un OBJET CONNECTÉ avec GOOGLE HOME ! [TUTO],UCwF5e6Lxzb0juciU0MlT26g,EasyTechTV,2019-01-10T18:43:00Z
6YoZhOy3F5A,GOOGLE HOME: Dicas nas Rotinas para personalização de Comandos de Voz da Automação Residencial #01,UCJVNMCRyqNf2ETPbLNoWp8A,Attilio Catalane,2019-05-23T13:49:19Z
9TQFqaYfq7A,Hàng HOT GOOGLE HUB là máy tính bảng hay trợ lý ảo? BÁ ĐẠO hơn Alexa nhiều,UCSeca92q0ZaRIcLOcsNsQyg,BanLinhKien.Vn,2019-07-04T01:42:49Z
n6gcjk6_i5U,Is the Google Home Max Still Worth It??,UCkHgegL2XiXSlwY5zeCKKyg,Chrome Unboxed,2020-01-24T21:10:09Z
EjGYhatHH9c,Lohnt sich der Kauf des Google Home Mini? Review nach zwei Monaten,UCVbAZmxn4vQR2QOfGF84OcQ,Momo Ghaffar,2018-01-06T09:00:02Z
qdZVy6vj-F4,"Automação Residencial : Primeiros Passos, Conceitos Básicos, Preços, Google Home, Amazon Alexa",UCJVNMCRyqNf2ETPbLNoWp8A,Attilio Catalane,2019-05-01T16:02:27Z
ZmOFx0AmRwo,Google Home Max vs. Sonos!,UCDxRn03fR0V8M7lms_YYXOQ,ModernDad,2017-12-20T00:29:16Z
y8nvE84WSwY,Google Home Mini | How To Make A Phone Call,UCmHO0Rw7nBFK2233om_vyWA,Tech Steve,2019-01-30T13:41:18Z
JaN7vR19I-E,"Google Home, 这一次很给力啊！",UCpzx9sMpCwKP_xTwoYZx7lA,MickeyworksTV,2017-06-04T09:26:25Z
9GJWatY1wV4,Google Home &amp; Amazon Alexa: Diferenças e Configurações que podem auxiliar na escolha do Assistente,UCJVNMCRyqNf2ETPbLNoWp8A,Attilio Catalane,2019-11-20T23:00:14Z
R0bH1rQFOXQ,Google Home Max Review - 12 Months Later,UCJOl2JvledP26K2OQ_HLgnQ,6 Months Later Reviews,2019-03-23T01:36:24Z
F46chkbZ3r4,Google Home &amp; Assistant Updates - July 2020,UCJOl2JvledP26K2OQ_HLgnQ,6 Months Later Reviews,2020-07-03T18:00:06Z
fGU41PVbRJs,Como Transformar seu Smartphone ANTIGO em um GOOGLE HOME,UCk70TYJHmZ_tsBKo-_SjP1w,CanalJMS Tech,2018-09-15T19:20:22Z
cSuxUc530A0,Inicia el día con Google home mini,UCSnnFpcONCZN_QcKX-LyyeA,AlkostoHiperAhorro,2020-11-24T15:31:17Z
uDqu-m_qIno,"Google: Chromecast – Instalação, Configuração e uso com Google Home com Comando de Voz em Português",UCJVNMCRyqNf2ETPbLNoWp8A,Attilio Catalane,2019-06-22T13:34:01Z
0xIUpgoLuN4,Google Home Hub - Chiar aveam nevoie de el? [UNBOXING &amp; REVIEW],UCNz5n8PoSGYSwkOH_SMnl2A,George Buhnici,2018-11-19T21:18:55Z
xEo8SybVB_Q,"20 Useful Google Assistant Commands for 2020! (Google Home Mini, Nest, Hub)",UCxg8tC0Ng0T6xizqsPWnV7g,Noah Herman,2020-05-09T01:12:48Z
zFr5K8rl1S8,Google Home Er IRRITERENDE!,UCnKXl4f_8Timd6gdJcNh7sw,Benjamin Jønsson,2019-03-20T15:19:52Z
pCBy_HGybKY,Google Home in de slaapkamer - Vraag het Google,UCIqEvFk7y5-VhSJopkjebMA,Google Nederland,2018-11-13T14:22:17Z
XhFZl2Pwcws,AUDIO COMPARISON: Google Nest Mini vs. Google Home Mini - Which sounds better in your smart home?,UCfM7sEXhbBfZZrFVPcnUhDA,Switched On Network,2019-10-29T19:25:24Z
pL6WKNOlYqM,Google Home Hub - How To Add Your Photos,UCmHO0Rw7nBFK2233om_vyWA,Tech Steve,2019-09-20T06:37:48Z
xmlLyS8qUq4,Chytrá domácnost - Google Home mini - hlasový asistent,UCtvxFor-SZvcyNX0FHWp3wg,JeezyJ,2018-01-07T11:30:01Z
AmmHrJ3ze3M,Google Home Mini - Unboxing &amp; Overview in HINDI,UCtqJlnJApltJBgfkq8j_KuA,The Nutri Gurl,2018-07-16T15:38:50Z
NVJcjU8b0jM,"The NEW (Amazing) Google Home Smart Display Interface, and More Google Updates!",UCtRSKEipM17PF7n0mi66btQ,Automate Your Life,2020-10-24T14:00:04Z
wVed34UcPvI,Google Home/Amazon Alexa - Slimmer Huis afl. 7,UCEoqPKAUnoZ5K6iXq0w6K0g,Coolblue,2018-04-13T14:57:27Z
sfyHbN-ZNas,聲控生活開始！Google Home生活小管家開箱《阿倫來介紹》,UCLh9M5KxWSlIqh2EC8ja_ug,Alan Channel / 阿倫頻道,2018-02-11T10:30:03Z
dBfCm1zV52o,【便利で楽しい】Google Home mini活用方法10選！グーグルホームミニの使い方,UC6ICl1k3zY-LQC8v3wV7bkQ,大橋澪,2019-07-20T08:42:30Z
WVEcVh9kDE4,How to Completely Factory Reset Google Home Mini (Easy),UCzvmBKjsw19OY5RBauMtVpA,MJ Tube,2018-11-08T11:18:43Z
BXJ8QS4sSqU,Amazon Echo vs Google Home - Why the Echo is better,UCFLyvD13JJG7gXrCmbK8uJQ,Craig's Tech Talk,2019-05-05T01:53:03Z
5WSblQ9Fk1c,3 Ways to Bluetooth on the Google Home Hub,UCjMVmz06abZGVdWjd1mAMnQ,Tech With Brett,2019-02-07T15:19:14Z
hhcKK4YE45w,Wat is de beste Google Home smart speaker met Google Assistant?,UCqsNfEAZ2UiubN60BSO3uIg,Tweakers Tech Hub,2019-06-05T13:55:39Z
G6iWQftZxrQ,Automação residencial com Google Home e equipamentos da Sonoff - Parte 1,UCC6nW1_l05ZbUTQLGjbwlWw,Gadgets Mundo Tec,2018-12-04T16:15:51Z
OUj8SUoJ-ZM,GOOGLE HOME OF THE WHOPPER    Cannes Lions 2017,UCyaUSXpBTlF6hO8Q9T0tOxg,INSIDER LATAM,2017-06-20T14:48:49Z
417M5bLy7uc,Google Home Hub Review - Slimme speaker en fotolijst in één,UCRztjeLfNzi2nw2nffMQtGA,tweakers,2018-11-08T05:00:00Z
n5gsY-G4Sl0,Google Home Hub and Nest Cameras Integrated and Working - Chromecast and Smart Displays Too!,UCtRSKEipM17PF7n0mi66btQ,Automate Your Life,2019-01-22T20:00:03Z
owq96S3UzhA,Google Nest Mini: Resmi di Indonesia. Apa bedanya dengan Home Mini?,UCMcc3QaUOdBVf3fY4G5pLCg,Ario Pratomo,2020-03-07T01:51:21Z
BF61APiKLdQ,【Nature Remo】アプリ設定方法を1から解説！アレクサ、Google Home、Siriと連携,UCkbgkg9cfvlxnh151-upZIQ,柴田ジュンヤ,2020-02-14T12:57:08Z
OlC__4Hw9w8,Google Home Max Review,UCgyqtNWZmIxTx3b6OxTSALw,Android Authority,2018-02-24T14:00:23Z
5RHtFgpE_kM,"Mi Smart Speaker - Should you buy this or Amazon Echo, Google Home Speaker?",UCix7HIJ74fUDlHDkAAcyRPA,Gogi Tech,2020-10-02T16:10:29Z
_8ORmA-nGEw,The Best Google Home Compatible Products In 2020,UCtRSKEipM17PF7n0mi66btQ,Automate Your Life,2020-02-26T15:00:13Z
AmbEgreR25E,Google home - Jak uruchomić język polski,UCFXql2ulfybkKO0qT_HHzKQ,Garage Make Zone,2019-05-30T09:24:15Z
Dwjf6b-NwZY,Conecta tu TV con Google Home muy fácil,UC0wEXkqp19pj1g66x7G7FnQ,Julio Tecnología,2020-04-20T21:48:51Z
KeD0w9rOHxk,TRUCO con GOOGLE HOME: Usa tu Cuenta de SPOTIFY o YOUTUBE MUSIC como si fuera PREMIUM,UCXS8xWHGQhu06BgzkwemDCg,Laita Digital,2019-10-23T11:35:52Z
atzMaGQQCx0,"Яндекс Алиса против Гугл Ассистента, Станция против Google Home – умная колонка на русском",UCnsNJy1oeczhCdBz9Kbx9xA,voiceapp,2018-11-19T15:01:55Z
9TSPwww9yrU,Amazon Echo oder Google Home? feat iKnowReview,UCHnFHitawGGUK8lJ86lOuOw,Venix,2017-12-21T11:23:01Z
eow-sBhqfkc,Como Configurar Google Home Mini (en español) - Nest Mini,UCwMGwPe6qW99O4iifloo02A,El Rincón De Cabra,2019-09-06T21:00:02Z
s6CoqJJzX7U,Dansk Google Home Setup (Clean setup) - Oktober 2018,UCMqwq2a2NI7BFpFbiEE7tcw,RepairGuyDK,2018-10-25T03:25:22Z
wP0ATFY3wq4,Como configurar el Google Home con la app,UCqlhToxqgcufPQoZd9Xdhgw,Sandorlex,2019-07-19T06:40:54Z
E_NBIg_3eM4,Alexa VS Google Home ¿Cuál es más rápido?,UCe1FDuO_eqI4M9U9UyLBOhA,Just Unboxing,2020-02-07T17:00:04Z
4x42nDYpexM,Meet Google Home Mini | Hands-free help around the house,UCCATREutrh2mAR--ZiKT53A,Google Canada,2017-12-21T01:17:28Z
3dyOcAHCqN8,"GOOGLE HOME, dispositivos de DOMÓTICA baratos!",UCkdFXlSdL1cmYbpbry2wsdA,Alejandro Pérez,2019-03-23T15:30:01Z
zPOYn1ydlYU,How to set up Philips Hue with Bluetooth lights with Google Home Mini,UCWUmAKsTQOJE-pZb7VOzVLw,Philips Hue,2019-09-18T07:58:48Z
lNJGVHU4xBc,Google Home Max review: A Google speaker built to rock,UCOmcA3f_RrH6b9NmcNa4tdg,CNET,2017-12-15T12:10:49Z
syMYWlPjJtk,5 Tipps und Tricks für Google Home und Google Home Mini,UC8DjxhVUAFLXij8yE7dJziA,Kammi.Net,2017-11-28T11:00:04Z
_LfOT-Ptcqs,Recensione GOOGLE HOME: tutto quello che devi sapere [ITA] 🇮🇹,UCs_ouz-Hdk1vQRofWi3JkDg,Tech Princess - Fjona Cakalli,2018-04-05T19:28:57Z
gAJdao8LzEk,Google Home vs Amazon Echo Dot in Malaysia,UCu2yODmemX1A0_wcMd1pUgw,KLGadgetTV,2017-02-02T11:59:15Z
3F_MyDAnFy4,Evening Routine||9.30 pm sleep routine||Google Home||White Noise|||WorldTradeCentre||Malayalam Vlog,UCdtr6p4pjj01Zmvqb_UsiBg,Aparna Prakash,2020-09-28T10:58:18Z
QBLtrUMUtRo,Use Your Google Home With Your Home Theater Speakers,UCtRSKEipM17PF7n0mi66btQ,Automate Your Life,2019-04-21T14:00:04Z
Ai_RptwVxew,De bizarre functies van Google Home - HEBBEDING,UC1Et9K-hHf-P_LzQkE_Q3Jw,De Telegraaf,2018-11-02T16:00:02Z
jIItCq5WKBs,How to factory reset a Google Home Mini,UCaj1WxrDXmI_fYHNKFAOGMQ,mydoodads,2018-06-25T08:09:25Z
94lFSQmXN6w,Hvad er Google Home? Elgiganten forklarer,UC6UJnoOITR8QjZRxJjC7AdQ,Elgiganten Danmark,2018-11-16T15:57:04Z
gOqG0zB2VRA,How To Pair &amp; Manage ANY Bluetooth Speaker with Google Home,UCk8WU5lvn-JNtGyUxhHm5dw,HelpCloud,2020-04-08T20:30:12Z
xVOydgYnOdM,Sácale MÁS provecho a la PANTALLA del Google Home | + Review Google Nest Hub,UCbotAzxzA5Y8WcjNh5K9ZkQ,Tecnoanalisis en Español,2019-07-11T15:13:16Z
ypCIevQWdo8,Apple&#39;s HomePod Mini takes on the best of the smallest from Amazon and Google,UCOmcA3f_RrH6b9NmcNa4tdg,CNET,2020-11-25T13:00:30Z
YDkPLpM_wzk,A Google Home Speaker That Actually DOESN&#39;T SUCK!?!,UCYLnawaM-36HncBBUeWrlGA,Paul Hibbert,2020-05-16T09:00:12Z
fpdv3umFgcs,Google Home Hub vs Amazon Echo Show 8,UCxT5mkudJ13rIQ9eB9zWHdg,Daniel Westow,2019-12-11T23:22:07Z
wztxT7wcn1E,Trucos AVANZADOS para tu GOOGLE HOME (Parte 2) | Google Nest Home Mini en 2021,UCbotAzxzA5Y8WcjNh5K9ZkQ,Tecnoanalisis en Español,2020-09-20T15:30:04Z
OGRghbEGQXI,Lenovo Smart Display vs  Google Home Hub,UCJOl2JvledP26K2OQ_HLgnQ,6 Months Later Reviews,2019-03-15T19:00:02Z
-oseMx-b4Zw,How to Change the WiFi Network on your Google Home,UC07rNeWO01xLjyNMY5cLo2A,Tech & Design,2020-05-21T17:00:01Z
_O3CSyp0wuM,DEN VET HVA?! - Google Home Mini Nest Førsteinntrykk,UCl5V_TPrZeBOMN8AG9A9EAw,Truls,2020-01-02T13:00:13Z
LYRYByQM6TE,Google Home - How To Change Wifi On Your Google Home Mini,UCOpj3niyHu-3m81EEMN6eSg,Jimbo Suson,2020-02-19T18:00:06Z
vA27SdxR_F0,How Do A House FULL of Google Homes Interact? My Experiences,UCM3hWnv_tshvTS660fhHH7A,Jimmy Tries World,2019-02-22T20:00:04Z
K6bhJzyZwrk,Google Home Mini po polsku przypomina o wódce z sąsiadami,UC5ovM8NwaboE9KFeiryEsqg,karol,2019-02-23T10:51:53Z
-d8YAtx5iUo,【すごく便利！】Google Homeで日々の家事まで快適になりました！,UCJ9KgnlnZdjjCPaqUGa12rQ,shino's channel,2019-01-31T12:00:01Z
XR0IOd4HXls,Vad är Google Home? Elgiganten förklarar,UCO4C0pnr5NrfoAURXv_oLBA,Elgiganten Sverige,2018-11-16T16:12:21Z
udaFwyQRJ9I,🐾結局どっちがいいの？Amazon EchoとGoogle Home両方使ってみての良いところレビュー【Alexa/Googleアシスタント/アレクサ】,UC2w3Uoc15Pi3KGkpmqxgaoQ,◯ちゃんねる🐾ガジェット,2019-01-04T23:01:44Z
fp7rJfxkbfI,What Is Wrong With My Google Home Right Now? Your Smart Home Questions Answered,UCtRSKEipM17PF7n0mi66btQ,Automate Your Life,2019-02-02T15:00:05Z
KLqAyLA5J_c,Amazon Echo Dot vs Google Home Mini | Which is better..?,UC_XSZa5Mltrux9P-JxU9yKQ,Smart Advisor,2020-01-12T20:19:43Z
bpBz7v0QNko,"Test Google Nest audio : nouveau Design, meilleur SON, il vaut VRAIMENT le COUP ! (vs Google Home)",UCGjKSSIpN7aYQluu04kPrsA,Brandon Le Proktor,2020-10-05T14:30:02Z
zK69Ba61dgg,Google Home Mini &amp; Google Nest Mini Stereo Pair: How to Set it Up!,UCfM7sEXhbBfZZrFVPcnUhDA,Switched On Network,2019-11-21T17:16:51Z
gE9WiyvExJ0,Google Home Mini Review and Unboxing Urdu/Hindi (Best Cheap Smart Speakers),UCqhQRA_Y8Lyu5BYnFOpvtAQ,Asad Ali TV,2020-10-02T15:00:12Z
kNHvgQsjgqw,Google Home Nest Hub in Sri Lanka,UCETxOvOv9_44-CUzsPlzyxQ,Chanux Bro,2020-04-19T11:41:24Z
xLaxAADysuc,Q&amp;A 勝間和代さん、Google Homeの何がどういいのですか？ どう使っていますか？,UCWoiNwdr7EEjgs2waxe_QpA,勝間和代が徹底的にマニアックな話をするYouTube,2019-08-24T10:48:32Z
YDSrPtydhfU,Google Home Mini Indonesia : Bikin Rumah Jadi Pintar!!!,UCW1CQgIa0ppQj_RzcVClGuA,GoodStuff ID,2020-01-27T23:59:50Z
NzsIxjTs86c,Remove Duplicate SmartThings Devices from the Google Home App,UCjMVmz06abZGVdWjd1mAMnQ,Tech With Brett,2020-01-29T14:15:00Z
f3-f0RBX3B0,PORQUE NO DEBES COMPRAR UN GOOGLE HOME MINI... Por lo menos en Mexico,UCbXSX18NhZMGCmaIhxDwMqw,KeplerTech,2018-10-17T02:44:01Z
RssXp0TiW7c,TRUCOS para sacarle partido a tú GOOGLE HOME,UCUrYBZGlEOSD1_ds_HcNd6A,Xataka TV,2019-07-29T14:00:06Z
qyNcP6Ai268,What&#39;s New With Google Home?  New Smart Display Features!,UCtRSKEipM17PF7n0mi66btQ,Automate Your Life,2020-10-03T14:00:07Z
7UJlQFfws0k,Google Home vs Google Home Mini (español),UCqmGmZrhkB8ko9Yz_s4eDVg,eMarket Perú,2018-09-23T14:40:11Z
KbKTh5xW_Ec,Hoe sluit ik een apparaat aan op Google Home?,UCEoqPKAUnoZ5K6iXq0w6K0g,Coolblue,2018-05-24T12:07:28Z
MHbdBXqd1JA,"Looping Infinito BOTEI A SIRI, Alexa e Google Home PRA BATER PAPO O DIA TODO",UCk70TYJHmZ_tsBKo-_SjP1w,CanalJMS Tech,2019-12-11T21:35:57Z
oCs25HXXuVA,Llévate tu Google Home Mini a cualquier sitio!! KIWI DESIGN,UCe1FDuO_eqI4M9U9UyLBOhA,Just Unboxing,2019-08-22T16:46:25Z
GIpCCY-mwyk,"Google Home : Qual Escolher ? Análise das Características, Especificações e Funcionalidades",UCJVNMCRyqNf2ETPbLNoWp8A,Attilio Catalane,2019-04-09T03:23:32Z
RaNoAZ6a52Y,[全港唯一] Google home mini 完整測試 語音助手及智能家居 冷氣/燈光/音響/電視,UChHvaHsz2u4J7EQOPKduPaA,hokoonho,2019-02-08T11:26:48Z
smZxOBwFTQw,Sengled Light Bulb Setup - Works with Alexa and Google Home,UCFLyvD13JJG7gXrCmbK8uJQ,Craig's Tech Talk,2019-03-06T13:43:06Z
f9YNFLkPWns,GOOGLE NEST MINI 3 Mo. Later - Review &amp; Comparison to Google Home Mini [Best Smart Home Speaker?],UCZZ4ivUawsXRktLKej8d6Xw,Mike O'Brien,2020-01-25T14:45:01Z
HglhPNGEVuQ,Connect Most Samsung 4k TV To Google Home (Using 2019 RU7100),UCmHO0Rw7nBFK2233om_vyWA,Tech Steve,2020-01-12T17:34:47Z
WEcWZGbgMDs,7 saker GOOGLE HOME kan göra som du kanske inte visste!,UCGXObQx4YMApLxMvMQRtGvg,Tony Andersson,2019-02-06T07:00:02Z
5hNjKwQSVT4,Google Home Unboxing and Review India (Hindi),UCCgifzWRU3I7Rl8zjRbfGJQ,HYBRID TECH,2018-05-01T10:12:45Z
dQHavOGQ6eY,How to FIX Duplicate Devices in the Google Home App,UCjMVmz06abZGVdWjd1mAMnQ,Tech With Brett,2019-11-13T18:05:27Z
o4_pOFJ_H4k,CONTROLA TODA TU CASA sólo con tu voz! Review Google Home Mini,UCGfgqt5NUCIgGUgk7rZ3NhQ,Morfi,2020-02-14T00:45:00Z
sYmdIv_tacE,智能家居第三步，串聯Google Home Mini跟之前的設備，成功完成語音操控電燈、冷氣等家電的目標！,UCvsNeOy8opQGjK5CP_NAtAA,分享家-羽,2019-07-26T15:49:27Z
5SRnrCkQYsk,Google Home Mini : Changer de wifi,UCwc8ELDUDl6I8S_-L0RroxA,Formation informatique avec Cedric,2019-12-04T17:00:04Z
RcJdOCoxBUY,google home mini einrichten google home installieren starten,UCfd8-d70tJXUBR-9zamW53A,The Handyman,2018-12-23T09:00:02Z
m1fLiY7OJd0,ما هو جهاز Google Home ؟ وكيف أستفيد منه ؟,UCBejAaBucjgm80bR7iB_mFg,نيوتك NewTech,2017-05-20T09:30:00Z
ZSrlOFs3ZbM,COMO INSTALAR o Google Home - Automação Residencial - Assistente de Voz,UCaW_dKGa3MerJT2zG_rO52w,Irwin Gomes - Elétrica e Automação,2019-08-19T12:30:00Z
lXEyV6G1Ee8,"Espelhamento do smartphone p/ TV via Google Home, TV Box | Smartphone mirroring to TV by Google Home",UCYyqWYAH33XneRTEXEtSmpg,xluccas,2020-03-30T17:07:28Z
WnaCxpMHVJY,What Are The Differences between The Google Home Mini and Nest Mini?,UCtRSKEipM17PF7n0mi66btQ,Automate Your Life,2020-01-08T15:00:11Z
sbz3ARxBOeU,Chytrá domácnost #9 - Google Home Mini [4K],UCfJ2hNsxBs8ufYish4eJn8g,Michal Kaláb - MK TECH,2019-04-17T14:00:08Z
NAeu7LP_gEA,Nest Audio vs. ALL Google Home/Nest speakers!,UCzIO0iX4yKW2P4NkmmKq1PA,9to5Google,2020-10-08T20:59:14Z
CLxEusMXzGU,10 Comenzi pentru Google Home / Assistant pe care nu (cred) că le știai - Cavaleria.ro,UCzfaZDsef1ZfqcGMR7sNQ-w,Cavaleria.ro,2020-04-25T08:47:58Z
cY5IQV7mXA8,Siri oder Alexa oder Google Assistant – Vertrauen &amp; Sicherheit im Smarthome,UCM1jNA8DM90LE4ywxBe8RmA,Spiel und Zeug,2019-03-03T16:33:42Z
zzNvi0cRbsk,"Google Home, czyli jak Google chce wejść do twojego domu",UC-867iftJqBGr0mQ83xqyKw,Spider's Web TV,2016-10-06T11:18:39Z
_dGu8icd5L0,NY APP för Google home! RUTINER och Ikea trådfri integration.,UCGXObQx4YMApLxMvMQRtGvg,Tony Andersson,2018-11-05T17:43:35Z
z8qIDZ-uxAE,ควบคุมอุปกรณ์ XIAOMI ผ่าน Google Assistant ! Mi Home with Google Home,UCbkVXXF6haOHCY5LZOZktPA,Mi More,2019-12-19T14:42:28Z
oFPMZLeIo5M,How to Set Up the Google Home,UCuNrF_lbOI2aoZ7g2tJ2A_A,A Secure Life,2019-05-02T19:56:15Z
BecoMj-XjgA,Google Home VS Google Home Mini เลือกตัวไหนดี,UCpskaPaIayeMs__cTKRJg_A,Crew Journey,2018-06-16T07:46:35Z
sfDrJ_ZkIbU,Google Home Mini - Review si unboxing in Romana,UCa9XE_5elY0KTU2m2pgssVQ,Adrian B.,2017-12-03T15:59:29Z
xc-KG68WGh4,Solucion ERROR de conexion GOOGLE HOME,UC1YUGcTACc_H6ws-G2pPkvg,SOLO SMARTECH,2020-03-06T17:00:14Z
dp_4G-d_cRk,J&#39;ai reçu Google Home Max ! (introuvable en France),UCdqC1GnhKs3aQw6j62uOvUw,Mister Perrier,2018-05-30T06:00:01Z
QQJezTL8anQ,How to Setup TECKIN Smart Bulb with Alexa and Google Home,UClv1BqvwFQRBClGwvaFcKLQ,Caroline Dunn,2019-02-12T17:00:03Z
EUzDiZ9MnOs,Google Home (INTRODUÇÃO),UCqW87gLGoFKlol67uWv2GGA,Vladimir Campos,2019-11-07T16:38:56Z
L9xl4idwYUA,Connecter ses volets roulants sur Google Home - Interrupteurs connectés,UC1Rrt3kiS311zm-Qg--bZnA,Mr Home Connect Google et Alexa,2020-01-05T19:24:15Z
7hjRz2RfNNY,"Die besten Gadgets für Amazon Echo, Google Home und HomePod - Venix",UCHnFHitawGGUK8lJ86lOuOw,Venix,2019-02-15T13:00:02Z
YcyiTTnnciw,Google Home приложение аналог HomeKit? Умный дом от Гугл обзор на примере Xiaomi Yeelight TP-Link,UCnsNJy1oeczhCdBz9Kbx9xA,voiceapp,2018-10-25T17:35:09Z
RkHPCAvWK1Y,Google Nest Audio 🔉 moins petit et plus costaud qu&#39;un Google Home !,UC_wnNCei4-GUbwn6EHzeV5g,GuiPoM - G. testé !,2020-10-22T15:30:01Z
CviqvTsDcCU,How To Connect Nest To Google Home,UCdmyYTlRW9kIn67GBZfFHvw,One Hour Smart Home,2019-11-07T19:17:01Z
ASTW8WTQqGY,Hoe kun je omroepen op je Google Home? - Vraag het Google,UCIqEvFk7y5-VhSJopkjebMA,Google Nederland,2019-10-08T10:30:00Z
OvYJN3XOjgA,Hva er Google Home? Elkjøp forklarer,UCqueYTQJ6tkgmeW2x9W6Zug,Elkjøp,2018-11-16T15:34:26Z
f13sKogM7NQ,"BEST Motorised Smart Blind Engine: Works with Google Home, Amazon Alexa and No Hub Needed",UCj2xtCfUX4tY0AouuOvEhNA,Geek Street,2019-11-22T07:00:04Z
2UCFLF9jgvc,Okos Hangszóró Ennyiért? - Google Home Mini,UC23b6UWEVLaTQKa1F5Yuv0g,/ ARPII,2019-02-13T18:00:00Z
RNVck3ri4Hg,O Google Home é fantástico!,UC5GGdEs1HaQcQDCKfVOQu5w,4gnews,2017-05-03T17:59:59Z
cVuQ3vmiVtE,การใช้ Google home ควบคุมการทำงานอุปกรณ์ Sonoff (Sonoff voice control with Google Home),UC5Utu5mXzhI21xKNqnHDseQ,Auto- techtools,2018-09-04T06:12:58Z
trWJAh3rGtM,Google Home Hub: Review completo en español,UCbhqFu89AiADJJh75rb6lag,Hipólito Delgado,2019-04-03T15:15:03Z
eye2HbBkuqA,Google Home Mini Setup - Google Home Mini Wifi Setup - Won&#39;t Connect To Wifi - Wifi Change Fix,UCqFjjsrJmj1Cjb61aXyQGdQ,How To Tech,2020-09-01T19:18:17Z
T_ZIeBpDCZ8,"Google Home Mini (Nest Mini): умная, громкая, красивая",UCyoLK278J8j5e4MpMT5WOyg,Вячеслав Горбатенко,2019-09-23T07:08:02Z
JX4A7jDdhNM,A Legjobb Okos Hangszóró - Google Home,UC23b6UWEVLaTQKa1F5Yuv0g,/ ARPII,2018-07-12T11:56:55Z
6RZFDhfLbrQ,7 FUNCIONALIDADES DO GOOGLE HOME MINI!,UCETEtpXXcz5pRrGZ5e9VBeQ,To na base,2019-09-21T18:18:44Z
CooDGQJ_EOo,"Yeelight - test inteligentnego oświetlania do domu | Google Home, Mi Home, Apple HomeKit",UCnRNy8j1mhhR-gl3HpWDV-Q,TestHubPL,2020-01-15T17:15:01Z
Jkz9TUMHRO0,Bombillas inteligentes con Google Home  💡 Controla la luz de casa con el móvil y con la voz 🏠,UCXS8xWHGQhu06BgzkwemDCg,Laita Digital,2019-09-10T19:14:05Z
YML9HzBLnkQ,GOOGLE HOME MINI EN 2020 ¿VALE LA PENA? UNBOXING Y REVIEW HONESTA,UCCJFjlA4EbTxyglqUd50bLg,SECURITY PC OFICIAL,2020-06-24T00:46:35Z
arlpUDT_xnM,Google Home Hub | Calendar,UCvffIPswBAz2PcxNK7k5bpg,Google UK,2018-11-16T12:26:51Z
oR_3iRqd4qQ,How to Connect Imou Security Camera to Google Home,UC7lId2wepehsWborma261PA,Imou,2019-01-14T11:42:56Z
GVfnMRIbB4Y,Месяц с Google Home Max. Опыт использования,UCT8ny3aoHGFPILpCsFuEq9A,Citrus,2018-03-29T13:45:51Z
FG_-UESYvu8,Google Homeを車載してみた,UCOkEN6NloGVLF1gI99m26Dw,sansan Fiat,2017-10-15T23:13:13Z
5IT1HiyEp_s,ISTO É INCRÍVEL - Google Home Mini | Paula Sousa,UCw9UgtYEIbEqNmIJcQWjp2A,Paula Sousa,2019-02-02T11:30:00Z
8lY6u4oTB5I,Google Home e Chromecast: SONO UNA FIGATA INSIEME! (Recensione),UCQotIEgiv6gedAqqsSZotQA,Marco Agnese,2019-08-04T12:10:01Z
7YBkLOpTKdw,סקירה Google Home Mini,UC_uFlziaou4xeiXlJ8CZuWA,Wisebuy,2018-01-31T13:30:01Z
WtMT6w67ZC0,Configurar Google Home Mini con Chromecast,UCp_MIMliqXC8sdHSPBrPPQQ,german smaltino,2020-03-18T21:44:12Z
dG5P72OUjSE,Cài đặt mới Google Home Mini - Tiếng Việt có trở lại không??,UCFHQbiNnRaEUPLKBZ4xd0CA,Tài Siro,2020-05-30T11:49:29Z
MCIVx9leEd4,Qué hay dentro de un Google Home Mini? - Cómo desarmarlo,UCWTOTpGe3z47_b-pKk2PH7g,Foli Tech,2020-10-21T17:00:09Z
hvXO2ybCoKA,Google Home Unboxing en Setup [Dutch],UCBHjoF8PyW0CnnjN11N3V0A,Tim van den Hoek,2018-10-27T16:46:00Z
pPcE_66ckVg,Googleのスマートスピーカー全種類の違いやできることを比較レビュー / Google HomeとGoogle Nest,UCe1gYz1rOS0iD4Oy1zKicfw,tomokezu,2020-07-07T09:00:25Z
fok5NHcwKOw,Google Home Mini: How to Setup (Step by Step) w/ iPhone or Android Phone,UC9GZRbjnnwPGz6wd0MXV1ow,WorldofTech,2020-08-04T06:00:06Z
uejoT2TB6zw,Collegare QUALSIASI cosa ad ALEXA o GOOGLE HOME con un gadget da 5€! [Sonoff Basic Tutorial],UCOIKmXmQjUsd3LZyboKzJxQ,Elia99Best,2019-07-29T12:00:13Z
p9moY0-zohc,Otázky a odpovědi s Google asistentkou - Google home mini,UCtvxFor-SZvcyNX0FHWp3wg,JeezyJ,2018-02-04T11:30:03Z
esXeHdJfVhI,Google Home In 2020! (Still Worth It?) (Review),UCy1PnKNVtEG-SfSzyIfnvrA,Simple Alpaca,2020-04-12T16:06:57Z
B2Ut4x9pDMg,Interruptor para Ventilador de Teto Inteligente TUYA - Compatível Google Home e Amazon Alexa #Comigo,UCJVNMCRyqNf2ETPbLNoWp8A,Attilio Catalane,2020-05-01T21:00:10Z
g8x3OHlVq1I,Smart Life App Google Assistant Setup // Google Home Smart Life How To,UCbrqaTDZphtEkiL7oNhLX8g,Digital David,2020-05-08T09:00:27Z
J6f67WEvlZw,"Asking Jibo, Alexa, and Google Home, &quot;What is the news?&quot;",UCrS-u9l6wI4DLKLxsFouNug,Eric Saund,2017-09-23T19:41:09Z
gDn-SlzOeh0,Google home inside my car review,UCGLcbo9cmAM0FWRvVsrW2Hw,steven ramkissoon,2016-12-31T20:53:21Z
nrS7rp5I1NI,Google Home日本版を使ってみた,UClwRo2CNeLwfyzR3L9ltDJw,Business Insider Japan,2017-10-05T03:00:00Z
hJNUjpUat8Y,【開箱+感受分享】Google Home Mini 真的能解放你雙手？ | 奶粉UNBOXING [中文字幕],UCBCGBMemsuIGLuC-nrb2mhw,奶粉 Jonathan,2019-06-03T10:30:00Z
bhtWSx4iX24,How To Cast Screen On Android To TV || Google Home Se Screen Cast करने का सही तरीका । DesignByRPV,UC5RVdFbQPbpAhbYSspv_QQQ,Design By RPV,2020-07-28T14:02:04Z
dI9ei4BzMmg,Connecter votre Smartphone à votre TV Smart: Google Home et Smartcast,UCXVAyLyLnNL1c_J_mrLjt6Q,AmZeeeL,2020-05-01T20:53:58Z
-ytk0GqtUyM,Mon TEST GOOGLE HOME vs AMAZON ECHO 3 et mes ASTUCES qui font la DIFFÉRENCE.,UCZPIYntdf59UPxjr9mEXbrA,Vynssou,2019-12-10T16:00:01Z
1TTHrb2IKQc,【#科技新柚】Google Home mini 中文問答,UCWCqP6FJYzsFJbpye4qADag,科技新柚,2018-12-04T15:10:44Z
fVybgwsG7r4,"Welches Smart Home ist das Beste für mich?🤔 (HomeKit, Alexa, Google Home) 🏠 | Nils-Hendrik Welk",UCvWQOze3mZUVHgHUyCe4s-Q,Nils-Hendrik Welk,2020-09-26T15:47:19Z
zxneESYRpQM,Google Home Review | 3 Years Later,UCaFo_ObzIyEgIUZRIelhfBw,Modern Accessory Review,2019-10-29T03:06:25Z
hsLCx7OmcJk,Top 10 Funções Google Home / Google Nest,UCbUIlJPgcnAjrpet2ImLMWQ,CLICOU TELECOM,2020-04-07T00:42:30Z
